Locus Identifier	Gene Model Name	Gene Description	Gene Model Type	Primary Gene Symbol	All Gene Symbols
AT1G69180	AT1G69180.1	Putative transcription factor with zinc finger and helix-loop-helix domains; the later similar to HMG boxes. Involved in specifying abaxial cell fate in the carpel. Four putative LFY binding sites (CCANTG) and two potential binding sites for MADS box proteins known as CArG boxes (CC(A/T)6GG) were found in the region spanning 3.8 Kb upstream of the CRC coding region. CRC targets YABBY genes  such as YUC4 in gynoecium development.	protein_coding	CRABS CLAW (CRC)	CRABS CLAW (CRC)	
AT1G74930	AT1G74930.1	encodes a member of the DREB subfamily A-5 of ERF/AP2 transcription factor family. The protein contains one AP2 domain. There are 15 members in this subfamily including RAP2.1; RAP2.9 and RAP2.10. The mRNA is cell-to-cell mobile.	protein_coding	 (ORA47)	 (ORA47); (ERF018)	
AT1G68670	AT1G68670.1	HHO2 is a HRS1 homolog. Nitrate-inducible expression. Also induced in roots by low Pi and is likely involved in maintaining phosphate homeostasis. It is  target of PHR1.Both HHO2 and HRS1 are involved in Ni cross regulation of Pi signaling. They function as transcriptional repressors of SPX1; SPX2; and SPX4 as part of a cascade to regulate nitrogen and phosphorus balance. Transcriptional repressors that functions with other NIGT genes as an important hub in the nutrient signaling network associated with the acquisition and use of nitrogen and phosphorus.	protein_coding	 (HHO2)	 (HHO2);NITRATE-INDUCIBLE, GARP-TYPE TRANSCRIPTIONAL REPRESSOR 1/HYPERSENSITIVE TO LOW PI-ELICITED PRIMARY ROOT SHORTENING 1.2 (NIGT1.2)	
AT1G74840	AT1G74840.1	Homeodomain-like superfamily protein;(source:Araport11)	protein_coding			
AT1G78080	AT1G78080.1	Encodes a member of the DREB subfamily A-6 of ERF/AP2 transcription factor family (RAP2.4). The protein contains one AP2 domain. Role in mediating light and ethylene signaling. The mRNA is cell-to-cell mobile.	protein_coding	RELATED TO AP2 4 (RAP2.4)	 (ATWIND1);WOUND INDUCED DEDIFFERENTIATION 1 (WIND1);RELATED TO AP2 4 (RAP2.4); (ERF59)	
AT1G72740	AT1G72740.1	Single Myb Histone (SMH) gene family member. Contains terminal acidic SANT domain.	protein_coding			
AT1G72050	AT1G72050.3	Encodes a transcriptional factor TFIIIA required for transcription of 5S rRNA gene.  5S rRNA is the smallest constituent of the ribosome.  Work on one of the gene models AT1G72050.2 showed that it encodes a protein with nine Cys(2)-His(2)-type zinc fingers; a characteristic feature of TFIIIA proteins. AT1G72050.2 also contains a 23 amino acid spacer between fingers 1 and 2; a 66 amino acid spacer between fingers 4 and 5; and a 50 amino acid non-finger C-terminal tail.  in vitro assay demonstrated that AT1g72050.2 binds to 5S rDNA  and efficiently stimulates the transcription of 5S rRNA. AT1g72050.2 also binds to 5S rRNA in vitro. AT1g72050.2 is located at several nuclear foci including the nucleolus and is absent from the cytoplasm.	protein_coding			
AT1G69120	AT1G69120.1	Floral homeotic gene encoding a MADS domain protein homologous to SRF transcription factors. Specifies floral meristem and sepal identity. Required for the transcriptional activation of AGAMOUS. Interacts with LEAFY.Binds to promoter and regulates the expression of flowering time genes SVP; SOC1 and AGL24.	protein_coding	APETALA1 (AP1)	APETALA1 (AP1);AGAMOUS-LIKE 7 (AGL7); (ATAP1)	
AT1G75080	AT1G75080.1	Encodes a positive regulator of the brassinosteroid (BR) signalling pathway that mediates both downstream BR responses and negative feedback regulation of BR biosynthesis. There is evidence for phosphorylation-dependent nucleocytoplasmic shuttling of BZR1. GSK3-like kinases (including BIN2); 14-3-3 proteins; and the phosphatase BSU1 seem to participate in this process. Phosphorylation also appears to affect BZR1's transcriptional activities.	protein_coding	BRASSINAZOLE-RESISTANT 1 (BZR1)	BRASSINAZOLE-RESISTANT 1 (BZR1)	
AT2G17950	AT2G17950.1	Homeobox gene controlling the stem cell pool. Expressed in the stem cell organizing center of meristems. Required to keep the stem cells in an undifferentiated state. Regulation of WUS transcription is a central checkpoint in stem cell control. The size of  the WUS expression domain controls the  size of the stem cell population through WUS indirectly activating the expression of  CLAVATA3 (CLV3) in the stem cells and CLV3 repressing WUS transcription through the CLV1 receptor kinase signaling pathway. Repression of WUS transcription through AGAMOUS (AG) activity controls stem cell activity in the determinate floral meristem. Binds to TAAT element core motif.  WUS is also involved in cell differentiation during anther development. Responds to CMV infection and represses virus accumulation in the meristem central and peripheral zones; inhibits viral protein synthesis by repressing the expression of plant S-adenosyl-L-methionine?dependent methyltransferases; which are involved in ribosomal RNA processing and ribosome stability.	protein_coding	WUSCHEL (WUS)	WUSCHEL (WUS); (PGA6);WUSCHEL 1 (WUS1)	
AT2G03500	AT2G03500.1	Encodes a nuclear localized member of the MYB family of transcriptional regulators that is involved in negative regulation of flowering.  It is expressed in vascular tissues and at low levels in the shoot apex during the transition to flowering. Loss of function mutations are early flowering.EFM is involved in the autonomous; thermosensory and GA pathways and expression is directly regulated by SVP. EFM interacts with JMJD5 to repress FT expression.	protein_coding	EARLY FLOWERING MYB PROTEIN (EFM)	EARLY FLOWERING MYB PROTEIN (EFM);HRS1 HOMOLOG4 (HHO4)	
AT1G66600	AT1G66600.1	A member of WRKY Transcription Factor; Group III. Involved in the regulation of plant responses to ABA and drought stress.	protein_coding	ABA OVERLY SENSITIVE MUTANT 3 (ABO3)	WRKY DNA-BINDING PROTEIN 63 (WRKY63); (ABO3);ABA OVERLY SENSITIVE MUTANT 3 (ABO3); (AtWRKY63)	
AT1G53910	AT1G53910.1	Encodes a member of the ERF (ethylene response factor) subfamily B-2 of ERF/AP2 transcription factor family (RAP2.12). The protein contains one AP2 domain. There are 5 members in this subfamily including RAP2.2 AND RAP2.12. Involved in oxygen sensing. It plays a key role in controlling root bending in response to hypoxia.	protein_coding	RELATED TO AP2 12 (RAP2.12)	RELATED TO AP2 12 (RAP2.12);ETHYLENE RESPONSE FACTOR 74 (ERF74)	
AT1G71450	AT1G71450.1	Encodes a member of the DREB subfamily A-4 of ERF/AP2 transcription factor family. The protein contains one AP2 domain. There are 17 members in this subfamily including TINY. FUF1 appears to negatively regulate certain ethylene responsive EDF genes thereby negatively regulating flower senescence.	protein_coding	FYF UP-REGULATING 321 FACTOR 1 (FUF1)	FYF UP-REGULATING 321 FACTOR 1 (FUF1)	
AT1G64620	AT1G64620.1	Plant-specific Dof transcription factor which regulates vascular cell differentiation  and lignin biosynthesis.	protein_coding	 (DOF1.8)	 (DOF1.8); (VDOF2)	
AT2G04880	AT2G04880.1	Encodes WRKY1; a member of the WRKY transcription factors in plants involved in disease resistance; abiotic stress; senescence as well as in some developmental processes.  WRKY1 is involved in the salicylic acid signaling pathway.  The crystal structure of the WRKY1 C-terminal domain revealed a zinc-binding site and identified the DNA-binding residues of WRKY1. The mRNA is cell-to-cell mobile.	protein_coding	ZINC-DEPENDENT ACTIVATOR PROTEIN-1 (ZAP1)	ZINC-DEPENDENT ACTIVATOR PROTEIN-1 (ZAP1); (ATWRKY1); (WRKY1)	
AT2G06200	AT2G06200.2	Growth regulating factor encoding transcription activator. One of the nine members of a GRF gene family; containing nuclear targeting domain. Involved in leaf development and expressed in root; shoot and flower	protein_coding			
AT2G02080	AT2G02080.1	C2H2 BIRD transcription factor family.	protein_coding	INDETERMINATE(ID)-DOMAIN 4 (IDD4)	INDETERMINATE(ID)-DOMAIN 4 (AtIDD4);INDETERMINATE(ID)-DOMAIN 4 (IDD4);IMPERIAL EAGLE (IME)	
AT2G18060	AT2G18060.1	Encodes a NAC-domain transcription factor that is expressed in developing vessels and protoxylem. Along with other members of this family; VND1 appears to regulate the development of genes required for secondary cell wall biosynthesis.	protein_coding	VASCULAR RELATED NAC-DOMAIN PROTEIN 1 (VND1)	VASCULAR RELATED NAC-DOMAIN PROTEIN 1 (VND1);ARABIDOPSIS NAC DOMAIN CONTAINING PROTEIN 37 (ANAC037)	
AT2G18380	AT2G18380.1	Encodes a member of the GATA factor family of zinc finger transcription factors.	protein_coding	GATA TRANSCRIPTION FACTOR 20 (GATA20)	HANABA TARANU LIKE 1 (HANL1);GATA TRANSCRIPTION FACTOR 20 (GATA20)	
AT1G77200	AT1G77200.1	encodes a member of the DREB subfamily A-4 of ERF/AP2 transcription factor family. The protein contains one AP2 domain. There are 17 members in this subfamily including TINY.	protein_coding			
AT1G68200	AT1G68200.1	Zinc finger C-x8-C-x5-C-x3-H type family protein;(source:Araport11)	protein_coding	CALLOSE DEFECTIVE MICROSPORE1 (CDM1)	CALLOSE DEFECTIVE MICROSPORE1 (CDM1); (ATC3H15)	
AT1G66370	AT1G66370.1	Encodes a member of the MYB family of transcription factors. Involved in regulation of anthocyanin biosynthesis. Affects the expression of enzymes involved in later steps of anthocyanin biosynthesis.	protein_coding	MYB DOMAIN PROTEIN 113 (MYB113)	MYB DOMAIN PROTEIN 113 (AtMYB113);MYB DOMAIN PROTEIN 113 (MYB113)	
AT1G59640	AT1G59640.2	A basic helix-loop-helix encoding gene (BIGPETAL; BPE) involved in the control of petal size. BPE is expressed via two mRNAs derived from an alternative splicing event. The BPEub (AT1G59640.1)transcript is expressed ubiquitously; whereas the BPEp (AT1G59640.2) transcript is preferentially expressed in petals. Plants that lack the petal-expressed variant BPEp have larger petals as a result of increased cell size.  BPEp is positively regulated downstream of APETALA3; PISTILLATA; APETALA1 and PISTILLATA3 and is negatively regulated downstream of AGAMOUS.	protein_coding	BIG PETAL P (BPEP)	BIG PETAL P (BPEP);BIG PETAL (BPE); (ZCW32)	
AT1G55110	AT1G55110.1	indeterminate(ID)-domain 7;(source:Araport11)	protein_coding	INDETERMINATE(ID)-DOMAIN 7 (IDD7)	INDETERMINATE(ID)-DOMAIN 7 (AtIDD7); (REDSTART);INDETERMINATE(ID)-DOMAIN 7 (IDD7)	
AT1G63030	AT1G63030.1	encodes a member of the DREB subfamily A-1 of ERF/AP2 transcription factor family (DDF2). The protein contains one AP2 domain. There are six members in this subfamily; including CBF1; CBF2; and CBF3. Overexpression of this gene results in the reduction of gibberellic acid biosynthesis. This gene is expressed in all tissues examined; but most abundantly expressed in rosette leaves and stems. Overexpression of DDF1; a putative paralog of this gene; also reduces gibberellic acid biosynthesis and makes the plants more tolerant to high-salinity levels.	protein_coding	DWARF AND DELAYED FLOWERING 2 (ddf2)	DWARF AND DELAYED FLOWERING 2 (ddf2);DWARF AND DELAYED FLOWERING 2 (ATDDF2)	
AT1G66420	AT1G66420.1	DNA-binding storekeeper protein-related transcriptional regulator;(source:Araport11)	protein_coding			
AT1G52150	AT1G52150.2	Member of the class III HD-ZIP protein family. Contains homeodomain and leucine zipper domain. Critical for vascular development and negatively regulates vascular cell differentiation.	protein_coding	 (ATHB-15)	 (ATHB-15); (HB15); (ATHB15);CORONA (CNA);INCURVATA 4 (ICU4)	
AT1G65620	AT1G65620.1	required for formation of a symmetric flat leaf lamina; encodes a member of a family of proteins characterized by cysteine repeats and a leucine zipper; involved in KNOX gene regulation.   Acts together with ASL1 in proximal-distal symmetry determination. Forms a complex with AS1 that binds to the BP promoter and leads to silencing of BP.	protein_coding	ASYMMETRIC LEAVES 2 (AS2)	ASYMMETRIC LEAVES 2 (AS2)	
AT2G01940	AT2G01940.3	Encodes a transcription factor that; together with IDD14 and IDD16; regulates auxin biosynthesis and transport and thus aerial organ morphogenesis and gravitropic responses. May be involved in an early event in shoot gravitropism such as gravity perception and/or a signaling process subsequent to amyloplast sedimentation as a putative transcription factor in gravity-perceptive cells.	protein_coding	SHOOT GRAVITROPISM 5 (SGR5)	SHOOT GRAVITROPISM 5 (SGR5);ARABIDOPSIS THALIANA INDETERMINATE(ID)-DOMAIN 15 (ATIDD15);INDETERMINATE(ID)-DOMAIN 15 (IDD15)	
AT2G03710	AT2G03710.1	This gene belongs to the family of SEP genes. It is involved in the development of sepals; petals; stamens and carpels. Additionally; it plays a central role in the determination of flower meristem and organ identity.	protein_coding	SEPALLATA 4 (SEP4)	AGAMOUS-LIKE 3 (AGL3);SEPALLATA 4 (SEP4)	
AT2G01930	AT2G01930.1	BASIC PENTACYSTEINE1 (BPC1) is a regulator of the homeotic Arabidopsis thaliana gene SEEDSTICK (STK); which controls ovule identity. BPC1 induces conformational changes by cooperative binding to purine-rich elements present in the STK regulatory sequence. STK is upregulated in bpc1 mutant.Along with BPC2; BPC1 binds to the promoter of and represses GALS1 thereby reducing beta 1;4- galactan accumulation.	protein_coding	BASIC PENTACYSTEINE1 (BPC1)	BASIC PENTACYSTEINE1 (BPC1); (BBR);BASIC PENTACYSTEINE1 (ATBPC1)	
AT2G02070	AT2G02070.1	RAVEN is part of the network regulated by BLJUEJAY; JACKDAW; SACRECROW and SHORT-ROOT to regulate root tissue patterning through cell lineage specification and asymmetric cell division. RAVEN is directly activated by SHORT-ROOT and directly repressed by JACKDAW.	protein_coding	INDETERMINATE(ID)-DOMAIN 5 (IDD5)	RAVEN (RVN);INDETERMINATE(ID)-DOMAIN 5 (AtIDD5);INDETERMINATE(ID)-DOMAIN 5 (IDD5)	
AT2G21900	AT2G21900.1	member of WRKY Transcription Factor; Group II-c	protein_coding	WRKY DNA-BINDING PROTEIN 59 (WRKY59)	WRKY DNA-BINDING PROTEIN 59 (WRKY59); (AtWRKY59)	
AT2G02450	AT2G02450.2	NAC domain containing protein 35;(source:Araport11)	protein_coding	LONG VEGETATIVE PHASE 1 (LOV1)	ARABIDOPSIS NAC DOMAIN CONTAINING PROTEIN 34 (anac034);NAC DOMAIN CONTAINING PROTEIN 35 (ANAC035);LONG VEGETATIVE PHASE 1 (LOV1);NAC DOMAIN CONTAINING PROTEIN 35 (NAC035); (ATLOV1)	
AT2G17180	AT2G17180.1	Target promoter of the male germline-specific transcription factor DUO1.	protein_coding	DUO1-ACTIVATED ZINC FINGER 1 (DAZ1)	DUO1-ACTIVATED ZINC FINGER 1 (DAZ1); (ZAT2)	
AT2G18350	AT2G18350.1	homeobox protein 24;(source:Araport11)	protein_coding	HOMEOBOX PROTEIN 24 (HB24)	HOMEOBOX PROTEIN 24 (HB24);ZINC FINGER HOMEODOMAIN 6 (ZHD6);HOMEOBOX PROTEIN 24 (AtHB24)	
AT2G03340	AT2G03340.1	Encodes WRKY DNA-binding protein 3 (WRKY3).	protein_coding	WRKY DNA-BINDING PROTEIN 3 (WRKY3)	WRKY DNA-BINDING PROTEIN 3 (WRKY3)	
AT2G01760	AT2G01760.2	member of Response Regulator: B- Type	protein_coding			
AT2G20400	AT2G20400.2	MYB-CC transcription factor. PHL4 is related to PHR1 (which regulates plant Pi starvation response) but it does not seem to have a significant role in Pi starvation.	protein_coding	PHR1-LIKE 4 (PHL4)	PHR1-LIKE 4 (PHL4)	
AT2G22430	AT2G22430.1	Encodes a homeodomain leucine zipper class I (HD-Zip I) protein that is a target of the protein phosphatase ABI1 and regulates hormone responses in Arabidopsis.	protein_coding	HOMEOBOX PROTEIN 6 (HB6)	HOMEOBOX PROTEIN 6 (ATHB6);HOMEOBOX PROTEIN 6 (HB6)	
AT2G21230	AT2G21230.3	bZIP30 is a transcriptional activator that is involved in regulation of growth and development of reproductive organs. It interacts with a number of developmental regulators including WUS; HEC1; KNAT1/BP; KNAT2; JAB; BEL1; and NGA1.	protein_coding	BASIC LEUCINE-ZIPPER 30 (BZIP30)	BASIC LEUCINE-ZIPPER 30 (BZIP30);DRINK ME (DKM)	
AT2G18160	AT2G18160.1	Encodes a b-ZIP transcription factor.	protein_coding	BASIC LEUCINE-ZIPPER 2 (bZIP2)	BASIC LEUCINE-ZIPPER 2 (ATBZIP2);G-BOX BINDING FACTOR 5 (GBF5);BASIC LEUCINE-ZIPPER 2 (bZIP2);FLORAL TRANSITION AT THE MERISTEM3 (FTM3)	
AT2G15740	AT2G15740.1	Member of a small family of zinc finger containing putative transcription factors.Similar to GAZ.	protein_coding	GAZ-LIKE 1 (GAL1)	GAZ-LIKE 1 (GAL1)	
AT2G02820	AT2G02820.2	Encodes a putative transcription factor (MYB88); involved in stomata development; double loss of MYB88 and FLP (MYB124) activity results in a failure of guard mother cells (GMCs) to adopt the guard cell fate; thus they continue to divide resulting in abnormal stomata consisting of clusters of numerous guard cell-like cells.  This phenotype is enhanced in double mutants over the single mutant flp phenotype. Also regulates female reproductive development.	protein_coding	MYB DOMAIN PROTEIN 88 (MYB88)	MYB DOMAIN PROTEIN 88 (MYB88)	
AT2G18300	AT2G18300.3	DNA-binding bHLH protein involved in positive regulation of cell elongation and proliferation and; negative control of plant immunity.One component of PRE-IBH1-HBI1 tripartite module.	protein_coding	HOMOLOG OF BEE2 INTERACTING WITH IBH 1 (HBI1)	HOMOLOG OF BEE2 INTERACTING WITH IBH 1 (HBI1)	
AT2G02540	AT2G02540.1	Zinc finger homeobox protein. Expressed in vascular tissue.  In a yeast one hybrid system was not able to transactivate a reporter gene.	protein_coding	HOMEOBOX PROTEIN 21 (HB21)	HOMEOBOX PROTEIN 21 (ATHB21);ZINC FINGER HOMEODOMAIN 3 (ZHD3);HOMEOBOX PROTEIN 21 (HB21);ZINC FINGER HOMEODOMAIN 4 (ZFHD4)	
AT1G60920	AT1G60920.1	AGAMOUS-like 55;(source:Araport11)	protein_coding	AGAMOUS-LIKE 55 (agl55)	AGAMOUS-LIKE 55 (agl55)	
AT1G61110	AT1G61110.1	NAC transcription regulator.  Regulates endosperm cell expansion during germination.	protein_coding	NAC DOMAIN CONTAINING PROTEIN 25 (NAC025)	NAC DOMAIN CONTAINING PROTEIN 25 (anac025); (NAC25);NAC DOMAIN CONTAINING PROTEIN 25 (NAC025)	
AT1G53230	AT1G53230.1	Encodes a member of a recently identified plant transcription factor family that includes Teosinte branched 1; Cycloidea 1; and proliferating cell nuclear antigen (PCNA) factors; PCF1 and 2. Regulated by miR319. Involved in heterochronic regulation of leaf differentiation.  Elongates hypocotyl when miR319-resistant version is overexpressed.  Suppresses auxin response by activating IAA3/SHY2 and SAUR genes.	protein_coding	TEOSINTE BRANCHED 1, CYCLOIDEA AND PCF TRANSCRIPTION FACTOR 3 (TCP3)	TEOSINTE BRANCHED 1, CYCLOIDEA AND PCF TRANSCRIPTION FACTOR 3 (TCP3)	
AT1G53160	AT1G53160.1	Encodes a member of the SPL (squamosa-promoter binding protein-like)gene family; a novel gene family encoding DNA binding proteins and putative transcription factors.  Contains the SBP-box; which encodes the SBP-domain; required and sufficient for interaction with DNA. It is involved in regulation of flowering and vegetative phase change.  Its temporal expression is regulated by the microRNA miR156. The target site for the microRNA is in the 3'UTR.	protein_coding	SQUAMOSA PROMOTER BINDING PROTEIN-LIKE 4 (SPL4)	SQUAMOSA PROMOTER BINDING PROTEIN-LIKE 4 (SPL4);FLORAL TRANSITION AT THE MERISTEM6 (FTM6)	
AT1G52880	AT1G52880.1	Transcription factor with a NAC domain.  Homologous to the petunia gene NAM which is required for the development of the shoot. Expressed in the embryo.	protein_coding	NO APICAL MERISTEM (NAM)	NO APICAL MERISTEM (NAM);ARABIDOPSIS NAC DOMAIN CONTAINING PROTEIN 18 (anac018); (ATNAM);NAC-REGULATED SEED MORPHOLOGY 2 (NARS2)	
AT1G52890	AT1G52890.1	encodes a NAC transcription factor whose expression is induced by drought; high salt; and abscisic acid. This gene binds to ERD1 promoter in vitro.	protein_coding	NAC DOMAIN CONTAINING PROTEIN 19 (NAC019)	NAC DOMAIN CONTAINING PROTEIN 19 (ANAC019);NAC DOMAIN CONTAINING PROTEIN 19 (NAC019); (ANAC19)	
AT1G54330	AT1G54330.1	NAC domain containing protein 20;(source:Araport11)	protein_coding	NAC DOMAIN CONTAINING PROTEIN 20 (NAC020)	NAC DOMAIN CONTAINING PROTEIN 20 (NAC020);NAC DOMAIN CONTAINING PROTEIN 20 (ANAC020)	
AT1G59750	AT1G59750.1	Encodes a member of the auxin response factor family. ARFs bind to the cis element 5'-TGTCTC-3' ARFs mediate changes in gene expression in response to auxin. ARF's form heterodimers with IAA/AUX genes. ARF1 enhances mutant phenotypes of ARF2 and may act with ARF2 to control aspects of maturation and senescence.ARF1:LUC and 3xHA:ARF1 proteins have a half-life of ~3-4 hours and their degradation is reduced by proteasome inhibitors. 3xHA:ARF1 degradation is not affected by a pre-treatment with IAA. A nuclear-targeted fusion protein containing the middle region of ARF1 linked to LUC:NLS has a similar half-life to the full-length ARF1:LUC construct. The degradation of 3xHA:ARF1 is not affected in an axr6-3 mutant grown at room temperature; although the degradation of AXR2/IAA7 is slowed under these conditions.	protein_coding	AUXIN RESPONSE FACTOR 1 (ARF1)	AUXIN RESPONSE FACTOR 1 (ARF1)	
AT2G01570	AT2G01570.1	Member of the VHIID/DELLA regulatory family. Contains homopolymeric serine and threonine residues; a putative nuclear localization signal; leucine heptad repeats; and an LXXLL motif. Putative transcriptional regulator repressing the gibberellin response and integration of phytohormone signalling. DELLAs repress cell proliferation and expansion that drives plant growth. The protein undergoes degradation in response to GA via the 26S proteasome. RGA1 binds to PIF3 and  inhibits its DNA binding activity and thus affects the expression of PIF3 regulated genes. RGA may be involved in reducing ROS accumulation in response to stress by up-regulating the transcription of superoxide dismutases. Represses GA-induced vegetative growth and floral initiation. Rapidly degraded in response to GA. Involved in fruit and flower development.	protein_coding	REPRESSOR OF GA1-3 1 (RGA1)	REPRESSOR OF GA1-3 1 (RGA1);REPRESSOR OF GA (RGA);REPRESSOR OF GA (RGA24)	
AT2G20570	AT2G20570.2	Encodes GLK1; Golden2-like 1; one of a pair of partially redundant nuclear transcription factors that regulate chloroplast development in a cell-autonomous manner. GLK2; Golden2-like 2; is encoded by At5g44190. GLK1 and GLK2 regulate the expression of the photosynthetic apparatus. GLK1 is also a member of the GARP transcription factor family. Promotes anthocyanin biosynthesis via an MBW complex-dependent pathway.	protein_coding	GBF'S PRO-RICH REGION-INTERACTING FACTOR 1 (GPRI1)	GBF'S PRO-RICH REGION-INTERACTING FACTOR 1 (GPRI1)	
AT2G22300	AT2G22300.1	Encodes a putative CAM binding transcription factor. Loss of function mutations show enhanced resistance to fungal and bacterial pathogens suggesting that CAMTA functions to suppress defense responses.It acts in the cold response pathway; it can bind to and activate the expression of DREB1 genes.	protein_coding	SIGNAL RESPONSIVE 1 (SR1)	SIGNAL RESPONSIVE 1 (SR1);CALMODULIN-BINDING TRANSCRIPTION ACTIVATOR 3 (CAMTA3)	
AT2G20180	AT2G20180.2	Encodes a novel Myc-related bHLH transcription factor that has transcriptional activation activity in the dark.  It is a key negative regulator of phytochrome-mediated seed germination and acts by inhibiting chlorophyll biosynthesis; light-mediated suppression of hypocotyl elongation and far-red light-mediated suppression of seed germination; and promoting negative gravitropism in hypocotyls.  Light reduces this activity in a phy-dependent manner.  The protein preferentially interacts with the Pfr forms of Phytochrome A (PhyA) and Phytochrome B (PhyB); is physically associated with APRR1/TOC1 and is degraded in red (R) and far-red (FR) light through the ubiquitin (ub)-26S proteasome pathway to optimize photomorphogenic development in Arabidopsis.  It also negatively regulates GA3 oxidase expression.	protein_coding	PHYTOCHROME INTERACTING FACTOR 3-LIKE 5 (PIL5)	PHYTOCHROME INTERACTING FACTOR 3-LIKE 5 (PIL5)	
AT1G53170	AT1G53170.1	encodes a member of the ERF (ethylene response factor) subfamily B-1 of ERF/AP2 transcription factor family (ATERF-8). The protein contains one AP2 domain. There are 15 members in this subfamily including ATERF-3; ATERF-4; ATERF-7; and leafy petiole.	protein_coding	ETHYLENE RESPONSE FACTOR 8 (ERF8)	ETHYLENE RESPONSE ELEMENT BINDING FACTOR 4 (ATERF8);ETHYLENE RESPONSE FACTOR 8 (ERF8); (ATERF-8)	
AT1G62300	AT1G62300.1	Encodes a transcription factor WRKY6.  Regulates Phosphate1 (Pho1) expression in response to low phosphate (Pi) stress.	protein_coding	 (WRKY6)	 (WRKY6); (ATWRKY6)	
AT2G01060	AT2G01060.1	myb-like HTH transcriptional regulator family protein;(source:Araport11)	protein_coding			
AT2G20110	AT2G20110.2	Tesmin/TSO1-like CXC domain-containing protein which is a transcriptional repressor of genes required for maintenance of DNA methylation; including MET1; CMT3; DDM1; KYP and VIMs. Functions redundantly with its paralogue TCX5 in repressing the expression of these genes.	protein_coding	 (TCX6)	 (TCX6)	
AT1G70000	AT1G70000.1	Encodes a MYB-like Domain transcription factor that plays a positive role in anthocyanin accumulation in response to light and cytokinin via repression of MYBL2.MYBD expression increased in response to light or cytokinin; and MYBD enhanced anthocyanin biosynthesis via the repression of MYBL2 encoding for a transcription factor that had a negative effect on this process. In addition; MYBD can bind in vivo to the MYBL2 promoter and a lower level of histone H3K9 acetylation (H3K9ac) at upstream region of MYBL2 in MYBD-OX in comparison to wild-type plants; implies that MYBD represses MYBL2 expression via an epigenetic mechanism.	protein_coding	 (MYBD)	 (MYBD)	
AT2G40740	AT2G40740.3	member of WRKY Transcription Factor; Group III	protein_coding			
AT2G44745	AT2G44745.1	WRKY gene family member involved in vascular/pith development.	protein_coding	WRKY DNA-BINDING PROTEIN 12 (WRKY12)	 (ATWRKY12);WRKY DNA-BINDING PROTEIN 12 (WRKY12)	
AT3G12720	AT3G12720.1	Member of the R2R3 factor gene family.	protein_coding	MYB DOMAIN PROTEIN 67 (MYB67)	 (ATY53);MYB DOMAIN PROTEIN 67 (ATMYB67); (MYB67);MYB DOMAIN PROTEIN 67 (MYB67)	
AT2G36610	AT2G36610.1	Encodes a homeodomain leucine zipper class I (HD-Zip I) protein.	protein_coding	HOMEOBOX PROTEIN 22 (HB22)	HOMEOBOX PROTEIN 22 (HB22);ARABIDOPSIS THALIANA HOMEOBOX PROTEIN 22 (ATHB22)	
