Locus Identifier	Gene Model Name	Gene Description	Gene Model Type	Primary Gene Symbol	All Gene Symbols
AT5G02320	AT5G02320.1	Encodes a putative c-MYB-like transcription factor of the MYB3R factor gene family (MYB3R5). Member of DREAM complex.	protein_coding	MYB DOMAIN PROTEIN 3R-5 (MYB3R-5)	MYB DOMAIN PROTEIN 3R-5 (MYB3R-5);ARABIDOPSIS THALIANA MYB DOMAIN PROTEIN 3R5 (ATMYB3R5)	
AT5G08130	AT5G08130.8	Encodes a basic helix-loop-helix (bHLH) family protein BIM1 (BES1-INTERACTING MYC-LIKE 1); involved in brassinosteroid signaling. It synergistically interacts with BES1 to bind to E box sequences (CANNTG). Positively modulates the shade avoidance syndrome in Arabidopsis seedlings.	protein_coding	BES1-INTERACTING MYC-LIKE1 (BIM1)	BES1-INTERACTING MYC-LIKE1 (BIM1)	
AT4G37180	AT4G37180.2	UIF1 is a nuclear and cytoplasmically localized myb-domain containing member of the GARP G2-like subfamily of transcription factors. Interacts with ULT1 and binds to the WUS promoter. UIF1 binding domains are also found in CUC and AG promoters suggesting they are also direct targets.  This locus was also identified as a putative cytoskeletal protein in a yeast screen.	protein_coding	ULT1 INTERACTING FACTOR 1 (UIF1)	ULT1 INTERACTING FACTOR 1 (UIF1);HRS1 HOMOLOG5 (HHO5)	
AT4G36740	AT4G36740.2	Encodes a homeodomain leucine zipper class I (HD-Zip I) protein.	protein_coding			
AT4G36730	AT4G36730.1	member of a gene family encoding basic leucine zipper proteins (GBFs) which bind the G-box	protein_coding	G-BOX BINDING FACTOR 1 (GBF1)	G-BOX BINDING FACTOR 1 (GBF1); (ATGBF1)	
AT4G31920	AT4G31920.1	Encodes an Arabidopsis response regulator (ARR) protein that acts in concert with other type-B ARRs in the cytokinin signaling pathway. Also involved in cytokinin-dependent inhibition of hypocotyl elongation and cytokinin-dependent greening and shooting in tissue culture. ARR1; ARR10; and ARR12 are redundant regulators of drought response; with ARR1 being the most critical. ARR1; ARR10 and ARR12 redundantly bind to the promoter of WUSCHEL (WUS); directly activate its transcription. In parallel; ARR1; ARR10 and ARR12 repress the expression of YUCCAs (YUCs); which encode a key enzyme for auxin biosynthesis; indirectly promoting WUS induction. The regulation of ARR1; ARR10 and ARR12 on WUS and YUCs is required for regeneration and maintenance of shoot meristem.	protein_coding	RESPONSE REGULATOR 10 (RR10)	RESPONSE REGULATOR 10 (ARR10);RESPONSE REGULATOR 10 (RR10)	
AT4G33280	AT4G33280.3	AP2/B3-like transcriptional factor family protein;(source:Araport11)	protein_coding			
AT4G32730	AT4G32730.2	Encodes a putative c-myb-like transcription factor with three MYB repeats. Part of the TSO1-MYB3R1 transcriptional module that controls the number and size of the stem cell pools at the shoot apex and root tip; the TSO1-MYB3R1 module is integrated with the cell cycle machinery to control cell division at the shoot meristem.	protein_coding	 (PC-MYB1)	 (PC-MYB1);MYB DOMAIN PROTEIN 3R1 (MYB3R-1); (ATMYB3R-1);A. THALIANA MYB DOMAIN PROTEIN 3R1 (ATMYB3R1);C-MYB-LIKE TRANSCRIPTION FACTOR 3R-1 (MYB3R1)	
AT4G35550	AT4G35550.1	Encodes a WUSCHEL-related homeobox gene family member with 65 amino acids in its homeodomain. WOX13 is the only family member that does not contain a sequence of eight residues (TLPLFPMH) downstream of the homeodomain called the WUS box.	protein_coding	WUSCHEL RELATED HOMEOBOX 13 (WOX13)	 (HB-4);WUSCHEL RELATED HOMEOBOX 13 (WOX13); (ATWOX13)	
AT4G21330	AT4G21330.1	Encodes a bHLH transcription factor strongly expressed in the tapetum from late anther stage 5 to early stage 6; and at a lower level in meiocytes. dyt1 mutant exhibits abnormal anther morphology beginning at anther stage 4. DYT1 acts downstream of SPL/NZZ and EMS1/EXS ; and regulates the expression of downstream genes like AMS; MS1 and other tapetum preferential genes for pollen development; primarily via TDF1.	protein_coding	DYSFUNCTIONAL TAPETUM 1 (DYT1)	DYSFUNCTIONAL TAPETUM 1 (DYT1)	
AT5G08330	AT5G08330.1	Circadian oscillator protein which interacts with bZIP63 and regulates a response of the circadian oscillator to sugar. Is not required for the sugar-induced circadian phase advance in the morning; regulates a response of CCA1 to sugars. Promotes together with TCP7; 8; 14; 15; 21; 22 and 23 endoreduplication-dependent cell expansion in leaf.	protein_coding	TCP DOMAIN PROTEIN 21 (TCP21)	 (ATTCP21);CCA1 HIKING EXPEDITION (CHE);TCP DOMAIN PROTEIN 21 (TCP21); (AtTCP11);TCP DOMAIN PROTEIN 11 (TCP11)	
AT5G06100	AT5G06100.2	Encodes a member of the myb family of transcription factors (MYB33); contains Pfam profile: PF00249 myb DNA-binding domain. Double mutants with MYB65 are male sterile- anthers are small; pollen development is defective. Spatial expression appears to be under the control of miR159; contains a target site for this micro RNA. A highly conserved RNA secondary structure abuts the miR159 binding site which facilitates its regulation by miR159. When the target site is mutated; expression is detected in leaves; roots; anther filament; pistil. The expression of a translational fusion is specific to anther locules in contrast to constructs lacking the miR159 target site. Phenotype is conditional and can be restored by lower temperature or higher light intensity.	protein_coding	MYB DOMAIN PROTEIN 33 (MYB33)	 (ATMYB33);MYB DOMAIN PROTEIN 33 (MYB33)	
AT5G08520	AT5G08520.1	Duplicated homeodomain-like superfamily protein;(source:Araport11)	protein_coding	 (MYBS2)	 (MYBS2)	
AT5G06960	AT5G06960.1	Encodes a basic leucine zipper (B-ZIP) containing protein that interacts with NPR1 to promote expression of salicylic acid induced genes. Binds the ocs-element.	protein_coding	OCS-ELEMENT BINDING FACTOR 5 (OBF5)	OCS-ELEMENT BINDING FACTOR 5 (OBF5);TGACG MOTIF-BINDING FACTOR 5 (TGA5)	
AT5G07100	AT5G07100.1	Encodes WRKY DNA-binding protein 26 (WRKY26).	protein_coding	WRKY DNA-BINDING PROTEIN 26 (WRKY26)	WRKY DNA-BINDING PROTEIN 26 (WRKY26)	
AT5G04760	AT5G04760.1	R-R-type MYB protein which plays negative roles in salt stress and is required for ABA signaling in Arabidopsis.	protein_coding	DIVARICATA2 (DIV2)	DIVARICATA2 (DIV2)	
AT5G04390	AT5G04390.1	C2H2-type zinc finger family protein;(source:Araport11)	protein_coding	 (ZAT14L)	 (ZAT14L)	
AT5G04410	AT5G04410.1	NAC family member; functions as a transcriptional activator; regulates flavonoid biosynthesis under high light. The mRNA is cell-to-cell mobile.	protein_coding	NAC DOMAIN CONTAINING PROTEIN 2 (NAC2)	ARABIDOPSIS NAC DOMAIN CONTAINING PROTEIN 78 (anac078); (NTL11); (NAC78);NAC DOMAIN CONTAINING PROTEIN 2 (NAC2)	
AT4G18890	AT4G18890.1	BES1/BZR1 homolog 3;(source:Araport11)	protein_coding	BES1/BZR1 HOMOLOG 3 (BEH3)	BES1/BZR1 HOMOLOG 3 (BEH3)	
AT4G18960	AT4G18960.1	Floral homeotic gene encoding a MADS domain transcription factor. Specifies floral meristem and carpel and stamen identity. Binds CArG box sequences. It is the only C function gene. It interacts genetically with the other homeotic genes to specify the floral organs.	protein_coding	AGAMOUS (AG)	AGAMOUS (AG)	
AT4G38000	AT4G38000.1	DNA binding with one finger 4.7;(source:Araport11)	protein_coding	DNA BINDING WITH ONE FINGER 4.7 (DOF4.7)	DNA BINDING WITH ONE FINGER 4.7 (DOF4.7)	
AT4G36160	AT4G36160.2	Encodes a NAC-domain transcription factor that is expressed in developing xylem. Over expression of this protein causes ectopic secondary cell wall growth. Complements some of the cell wall defects seen in SND1/NST1 double mutants.	protein_coding			
AT4G18390	AT4G18390.1	Transcription factor which photomorphogenic growth by activating HY5 and HYH.	protein_coding	TEOSINTE BRANCHED 1, CYCLOIDEA AND PCF TRANSCRIPTION FACTOR 2 (TCP2)	TEOSINTE BRANCHED 1, CYCLOIDEA AND PCF TRANSCRIPTION FACTOR 2 (TCP2)	
AT4G17490	AT4G17490.1	Encodes a member of the ERF (ethylene response factor) subfamily B-3 of ERF/AP2 transcription factor family (ATERF-6). The protein contains one AP2 domain. There are 18 members in this subfamily including ATERF-1; ATERF-2; AND ATERF-5. It is involved in the response to reactive oxygen species and light stress. Involved in regulating root architecture and the response to cold stress.	protein_coding	ETHYLENE RESPONSIVE ELEMENT BINDING FACTOR 6 (ERF6)	ETHYLENE RESPONSIVE ELEMENT BINDING FACTOR 6 (ATERF6); (ERF-6-6);ETHYLENE RESPONSIVE ELEMENT BINDING FACTOR 6 (ERF6); (ERF103)	
AT4G16150	AT4G16150.1	CATMA5 is a transcriptional activator. It acts in the cold response pathway; it can bind to and activate the expression of DREB1 genes.	protein_coding	CALMODULIN-BINDING TRANSCRIPTION ACTIVATOR 2 (CAMTA5)	CALMODULIN-BINDING TRANSCRIPTION ACTIVATOR 2 (CAMTA5)	
AT4G14770	AT4G14770.1	Regulates fate transition and cell Divisions in the stomatal lineage.	protein_coding	TESMIN/TSO1-LIKE CXC 2 (TCX2)	TESMIN/TSO1-LIKE CXC 2 (TCX2);TESMIN/TSO1-LIKE CXC 2 (ATTCX2); (SOL2)	
AT4G27950	AT4G27950.1	Encodes a member of the ERF (ethylene response factor) subfamily B-5 of ERF/AP2 transcription factor family. The protein contains one AP2 domain. There are 7 members in this subfamily. CRF proteins relocalize to the nucleus in response to cytokinin.	protein_coding	CYTOKININ RESPONSE FACTOR 4 (CRF4)	CYTOKININ RESPONSE FACTOR 4 (CRF4)	
AT4G28110	AT4G28110.1	Member of the R2R3 factor gene family. Expression is induced in response to desiccation; ABA and salt treatment. Overexpression of Myb41 results in abnormal cuticle development and decreased cell expansion.	protein_coding	MYB DOMAIN PROTEIN 41 (MYB41)	MYB DOMAIN PROTEIN 41 (AtMYB41);MYB DOMAIN PROTEIN 41 (MYB41)	
AT4G26640	AT4G26640.2	member of WRKY Transcription Factor; Group I	protein_coding	 (WRKY20)	 (AtWRKY20); (WRKY20)	
AT4G24470	AT4G24470.3	ZIM is a putative transcription factor containing an atypical GATA-type zinc-finger motif.	protein_coding	ZINC-FINGER PROTEIN EXPRESSED IN INFLORESCENCE MERISTEM (ZIM)	EMBRYO-DEFECTIVE-DEVELOPMENT 1 (EDD1);ZINC-FINGER PROTEIN EXPRESSED IN INFLORESCENCE MERISTEM (ZIM); (TIFY1);GATA TRANSCRIPTION FACTOR 25 (GATA25); (ATTIFY1)	
AT4G24240	AT4G24240.1	Encodes a Ca-dependent calmodulin binding protein. Sequence similarity to the WRKY transcription factor gene family.	protein_coding	WRKY DNA-BINDING PROTEIN 7 (WRKY7)	WRKY DNA-BINDING PROTEIN 7 (WRKY7); (ATWRKY7)	
AT4G18170	AT4G18170.1	Member of WRKY Transcription Factor; Group II-c.  Involved in the activation of salicylic acid biosynthesis genes ICS1 and PBS3. In the ovule; it is expressed in hypodermal somatic cells and appears to play a role in supression of megasporocyte cell fate. In the leaf if is upstream of  FHY3  and regulates light-mediated leaf senescence.	protein_coding	WRKY DNA-BINDING PROTEIN 28 (WRKY28)	WRKY DNA-BINDING PROTEIN 28 (WRKY28); (AtWRKY28)	
AT5G10510	AT5G10510.3	Encodes an AP2-domain transcription factor involved in root stem cell identity and root development. It is also required to maintain high levels of PIN1 expression at the periphery of the meristem and modulate local auxin production in the central region of the SAM which underlies phyllotactic transitions. Intronic sequences are required for its expression in flowers.Acts redundantly with PLT5 and 7 in lateral root pattern formation.	protein_coding	AINTEGUMENTA-LIKE 6 (AIL6)	AINTEGUMENTA-LIKE 6 (AIL6)	
AT5G03150	AT5G03150.1	JKD is a nuclear-localized putative transcription factor of the BIRDS/IDD C2H2 zinc finger family. JKD and its homologue BIB; restrict SHR movement to a single layer; the endodermis; and delimit tissue boundaries in the root meristem through a process that involves nuclear retention through protein complex formation. JKD mutation leads to periclinal divisions in the cortex; increased cell numbers in the circumference of the cortical and epidermal layers; a disrupted QC marker expression pattern; and disorganized QC and columella cells. This effect is enhanced in jkd bib double mutants where tissue boundaries cannot be maintained due to excessive SHR movement. JKD and BIB restrict CYCIND6 expression to cortex and endodermis stem cells to prevent formative divisions in the ground tissue.  JKD physically interacts with cell fate determinants SCR and SHR in a cell type specific manner. Native FRET-FLIM analysis showed higher JKD-SCR complex in the endodermis and predominant JKD-SHR in the QC and cortex/endodermis stem cells. In addition; JKD; SCR and SHR form a ternary complex whose conformation is cell type dependent; conformational changes of this complex differentially regulate SCR and WOX5 expression to specify endodermal cell fate and QC function respectively. Its mRNA is cell-to-cell mobile.	protein_coding	JACKDAW (JKD)	JACKDAW (JKD)	
AT5G03790	AT5G03790.1	Encodes a homeodomain leucine zipper class I (HD-Zip I) meristem identity regulator that acts together with LFY to induce CAL expression.  It binds to the CAL promoter proximal CAATNATTG element.  LMI1 acts primarily downstream of LFY in meristem identity regulation.  The interaction between LFY; LMI1 and CAL resembles a feed-forward loop transcriptional network motif.  The gene also had additional LFY-independent roles in leaf morphogenesis and bract formation.	protein_coding	HOMEOBOX 51 (HB51)	 (ATHB51);HOMEOBOX 51 (HB51);LATE MERISTEM IDENTITY1 (LMI1)	
AT5G02840	AT5G02840.1	Encodes RVE4; a homolog of the circadian rhythm regulator RVE8. rve4 rve6 rve8 triple mutants display an extremely long circadian period; with delayed and reduced expression of evening-phased clock genes. Involved in heat shock response.	protein_coding	LHY/CCA1-LIKE 1 (LCL1)	REVEILLE 4 (RVE4);LHY/CCA1-LIKE 1 (LCL1)	
AT5G05790	AT5G05790.1	Duplicated homeodomain-like superfamily protein;(source:Araport11)	protein_coding			
AT5G05550	AT5G05550.2	Encodes trihelix-domain transcription factor VFP5. Interacts with agrobacterium virulence protein VirF.	protein_coding	VFP5 (VFP5)	VFP5 (VFP5);EIN2 NUCLEAR ASSOCIATED PROTEIN 2 (ENAP2); (At5g05550)	
AT5G05090	AT5G05090.1	Homeodomain-like superfamily protein;(source:Araport11)	protein_coding			
AT5G01380	AT5G01380.1	Homeodomain-like superfamily protein;(source:Araport11)	protein_coding			
AT5G01900	AT5G01900.1	member of WRKY Transcription Factor; Group III	protein_coding	WRKY DNA-BINDING PROTEIN 62 (WRKY62)	ARABIDOPSIS THALIANA WRKY DNA-BINDING PROTEIN 62 (ATWRKY62);WRKY DNA-BINDING PROTEIN 62 (WRKY62)	
AT5G08070	AT5G08070.1	TCP gene involved in heterochronic control of leaf differentiation.  Promotes shade-induced hypocotyl growth by activating PIFs and YUCs. Together with TCP5 and 13 promotes thermomorphogenic hypocotyl elongation along with PIF4.	protein_coding	TCP DOMAIN PROTEIN 17 (tcp17)	TCP DOMAIN PROTEIN 17 (tcp17)	
AT5G07310	AT5G07310.1	encodes a member of the ERF (ethylene response factor) subfamily B-4 of ERF/AP2 transcription factor family. The protein contains one AP2 domain. There are 7 members in this subfamily. Cytokinin production induced by jasmonate represses adventitious rooting.	protein_coding	ETHYLENE RESPONSE FACTOR 115 (ERF115)	ETHYLENE RESPONSE FACTOR 115 (ERF115)	
AT4G18880	AT4G18880.1	Encodes a member of Heat Stress Transcription Factor(Hsf) family that is a substrate of the MPK3/MPK6 signaling and regulates stress responses.	protein_coding	HEAT SHOCK TRANSCRIPTION FACTOR  A4A (HSF A4A)	HEAT SHOCK TRANSCRIPTION FACTOR  A4A (HSF A4A);ARABIDOPSIS THALIANA HEAT SHOCK TRANSCRIPTION FACTOR  A4A (AT-HSFA4A)	
AT4G18770	AT4G18770.1	MYB98 is a member of the R2R3-MYB gene family; the members of which likely encode transcription factors. Within an ovule; MYB98 is expressed exclusively in the synergid cells; and mutations in this gene affect the female gametophyte specifically. myb98 female gametophytes are affected in two unique features of the synergid cell; pollen tube guidance and the filiform apparatus; but are otherwise normal. This suggests that MYB98 controls the development of specific features within the synergid cell during female gametophyte development. MYB98 also is expressed in trichomes and endosperm. Homozygous myb98 mutants exhibit no sporophytic defects; including trichome and endosperm defects.	protein_coding	MYB DOMAIN PROTEIN 98 (MYB98)	MYB DOMAIN PROTEIN 98 (MYB98);MYB DOMAIN PROTEIN 98 (AtMYB98)	
AT4G18450	AT4G18450.1	encodes a member of the ERF (ethylene response factor) subfamily B-3 of ERF/AP2 transcription factor family. The protein contains one AP2 domain. There are 18 members in this subfamily including ATERF-1; ATERF-2; AND ATERF-5.	protein_coding			
AT4G23550	AT4G23550.1	Encodes WRKY DNA-binding protein 29 (WRKY29). The mRNA is cell-to-cell mobile.	protein_coding	 (WRKY29)	 (WRKY29); (ATWRKY29)	
AT4G23750	AT4G23750.1	encodes a member of the ERF (ethylene response factor) subfamily B-5 of ERF/AP2 transcription factor family. The protein contains one AP2 domain. There are 7 members in this subfamily. Monopteros target gene. CRF proteins relocalize to the nucleus in response to cytokinin.	protein_coding	CYTOKININ RESPONSE FACTOR 2 (CRF2)	CYTOKININ RESPONSE FACTOR 2 (CRF2);TARGET OF MONOPTEROS 3 (TMO3)	
AT4G16750	AT4G16750.1	encodes a member of the DREB subfamily A-4 of ERF/AP2 transcription factor family. The protein contains one AP2 domain. There are 17 members in this subfamily including TINY.	protein_coding	ETHYLENE-RESPONSIVE TRANSCRIPTION FACTOR 39 (ERF39)	ETHYLENE-RESPONSIVE TRANSCRIPTION FACTOR 39 (ERF39)	
AT4G16110	AT4G16110.1	Encodes a pollen-specific transcription factor involved in the expression of nuclear genes for components of mitochondrial complex I in Arabidopsis. Acts in concert with other type-B ARRs in the cytokinin signaling pathway. AHK3 mediates cytokinin-induced phosphorylation of ARR2 on the Asp-80 residue. This phosphorylation plays a positive role of ARR2 in cytokinin-mediated control of leaf longevity. Also involved in cytokinin-dependent inhibition of hypocotyl elongation.	protein_coding	RESPONSE REGULATOR 2 (RR2)	RESPONSE REGULATOR 2 (ARR2);RESPONSE REGULATOR 2 (RR2)	
AT4G15090	AT4G15090.1	Encodes a nuclear localized protein involved in far red light response signaling. Loss of function mutants are defective in far red light responses. For example:prevents leaf senescence under high ratio of red/far-red light conditions.Interacts with homologous gene FHY3.	protein_coding	FAR-RED IMPAIRED RESPONSE 1 (FAR1)	FAR-RED IMPAIRED RESPONSE 1 (FAR1)	
AT4G14410	AT4G14410.1	Basic helix loop helix transcription factor involved in stress mediated signaling during germination.	protein_coding	BASIC HELIX-LOOP-HELIX 104 (bHLH104)	BASIC HELIX-LOOP-HELIX 104 (bHLH104)	
AT4G25470	AT4G25470.1	Encodes a member of the DREB subfamily A-1 of ERF/AP2 transcription factor family (CBF2). The protein contains one AP2 domain. There are six members in this subfamily; including CBF1; CBF2; and CBF3. This gene is involved in response to low temperature; abscisic acid; and circadian rhythm. Overexpressing this gene leads to increased freeze tolerance and induces the expression level of 85 cold-induced genes and reduces the expression level of 8 cold-repressed genes; which constitute the CBF2 regulon. Mutations in CBF2 increases the expression level of CBF1 and CBF3; suggesting that this gene may be involved in a negative regulatory or feedback circuit of the CBF pathway.	protein_coding	C-REPEAT/DRE BINDING FACTOR 2 (CBF2)	C-REPEAT/DRE BINDING FACTOR 2 (CBF2);DRE/CRT-BINDING PROTEIN 1C (DREB1C);FREEZING TOLERANCE QTL 4 (FTQ4); (ATCBF2)	
AT4G25480	AT4G25480.1	Encodes a member of the DREB subfamily A-1 of ERF/AP2 transcription factor family (CBF3). The protein contains one AP2 domain. There are six members in this subfamily; including CBF1; CBF2; and CBF3. This gene is involved in response to low temperature and abscisic acid.	protein_coding	DEHYDRATION RESPONSE ELEMENT B1A (DREB1A)	DEHYDRATION RESPONSE ELEMENT B1A (DREB1A);C-REPEAT BINDING FACTOR  3 (CBF3); (ATCBF3)	
AT4G25490	AT4G25490.1	Transcriptional activator that binds to the DRE/CRT regulatory element and induces COR (cold-regulated) gene expression increasing plant freezing tolerance. It encodes a member of the DREB subfamily A-1 of ERF/AP2 transcription factor family (CBF1). The protein contains one AP2 domain. There are six members in this subfamily; including CBF1; CBF2; and CBF3. This gene is involved in response to low temperature and abscisic acid.	protein_coding	C-REPEAT/DRE BINDING FACTOR 1 (CBF1)	C-REPEAT/DRE BINDING FACTOR 1 (CBF1);DRE BINDING PROTEIN 1B (DREB1B); (ATCBF1)	
AT4G24020	AT4G24020.1	Encodes NIN Like Protein 7 (NLP7).  Modulates nitrate sensing and metabolism.  Mutants of NLP7 show features of nitrogen-starved plants and are tolerant to drought stress.  Localized in the nucleus and functions as a putative transcription factor. The mRNA is cell-to-cell mobile.	protein_coding	NIN LIKE PROTEIN 7 (NLP7)	NIN LIKE PROTEIN 7 (NLP7)	
AT4G17880	AT4G17880.1	MYC4 is bHLH transcriptional regulator. It functions  as a JAZ-interacting transcription factor that acts together with MYC2 and MYC3 to activate JA-responses. It also functions in blue light mediated secondary cell wall biogenesis via regulation of NST1 expression. MYC4 directly binds to NST1 promoter and activates its expression.	protein_coding	 (MYC4)	 (MYC4)	
AT5G06950	AT5G06950.1	Transcription factor of the B-ZIP family that has high affinity for C-box motifs. Interacts with NPR1 and may regulate PR gene expression. Phosphorylated by a CK2-like protein in vitro. Phosphorylation is enhanced by salicylic acid treatment. Under stress conditions; it acts to negatively control SA accumulation.   that induce the hormone production.	protein_coding	 (AHBP-1B)	 (AHBP-1B);TGACG SEQUENCE-SPECIFIC BINDING PROTEIN 2 (TGA2); (ATTGA2)	
AT4G28140	AT4G28140.1	encodes a member of the DREB subfamily A-6 of ERF/AP2 transcription factor family. The protein contains one AP2 domain. There are 8 members in this subfamily including RAP2.4. Regulated by heat shock.	protein_coding	ETHYLENE RESPONSIVE FACTOR54 (ERF54)	ETHYLENE RESPONSIVE FACTOR54 (ERF54)	
AT4G17980	AT4G17980.2	Encodes ANAC071; a transcription factor involved in cell proliferation in incised inflorescence stems.	protein_coding			
AT5G07680	AT5G07680.1	NAC domain containing protein 80;(source:Araport11)	protein_coding	NAC DOMAIN CONTAINING PROTEIN 80 (NAC080)	NAC DOMAIN CONTAINING PROTEIN 80 (ANAC080);ARABIDOPSIS NAC DOMAIN CONTAINING PROTEIN 79 (ANAC079); (NAC4);NAC DOMAIN CONTAINING PROTEIN 80 (NAC080); (ATNAC4)	
AT5G02460	AT5G02460.1	PEAR protein involved in the formation of a short-range concentration gradient that peaks at protophloem sieve elements; and activates gene expression that promotes radial growth. Locally promotes transcription of inhibitory HD-ZIP III genes; and thereby establishes a negative-feedback loop that forms a robust boundary that demarks the zone of cell division.	protein_coding	PHLOEM EARLY DOF 2 (PEAR2)	PHLOEM EARLY DOF 2 (PEAR2)	
AT5G09410	AT5G09410.3	calmodulin-binding protein; similar to another ethylene-upregulated calmodulin-binding protein ER1 GI:11612392 from (Nicotiana tabacum)	protein_coding	ETHYLENE INDUCED CALMODULIN BINDING PROTEIN (EICBP.B)	ETHYLENE INDUCED CALMODULIN BINDING PROTEIN (EICBP.B)	
AT4G29000	AT4G29000.1	Tesmin/TSO1-like CXC domain-containing protein which is a transcriptional repressor of genes required for maintenance of DNA methylation; including MET1; CMT3; DDM1; KYP and VIMs. Functions redundantly with its paralogue TCX6 in repressing the expression of these genes.	protein_coding	 (TCX5)	 (TCX5)	
AT4G22070	AT4G22070.1	member of WRKY Transcription Factor; Group II-b	protein_coding	WRKY DNA-BINDING PROTEIN 31 (WRKY31)	 (AtWRKY31);WRKY DNA-BINDING PROTEIN 31 (WRKY31)	
AT4G21080	AT4G21080.1	Dof-type zinc finger domain-containing protein;(source:Araport11)	protein_coding	DNA-BINDING WITH ONE FINGER 4.5 (DOF4.5)	DNA-BINDING WITH ONE FINGER 4.5 (DOF4.5); (ATDOF4.5)	
AT4G40060	AT4G40060.1	Encodes a homeodomain leucine zipper class I (HD-Zip I) protein.	protein_coding	HOMEOBOX PROTEIN 16 (HB16)	HOMEOBOX PROTEIN 16 (ATHB16); (ATHB-16);HOMEOBOX PROTEIN 16 (HB16)	
AT5G10280	AT5G10280.1	Encodes a putative transcription factor (MYB92).	protein_coding	MYB DOMAIN PROTEIN 92 (MYB92)	MYB DOMAIN PROTEIN 92 (MYB92); (ATMYB64);MYB DOMAIN PROTEIN 92 (ATMYB92)	
AT5G10140	AT5G10140.1	MADS-box protein encoded by FLOWERING LOCUS C - transcription factor that functions as a repressor of floral transition and contributes to temperature compensation of the circadian clock. Expression is downregulated during cold treatment. Vernalization; FRI and the autonomous pathway all influence the state of FLC chromatin. Both maternal and paternal alleles are reset by vernalization; but their earliest activation differs in timing and location. Histone H3 trimethylation at lysine 4 and histone acetylation are associated with active FLC expression; whereas histone deacetylation and histone H3 dimethylation at lysines 9 and 27 are involved in FLC repression. Expression is also repressed by two small RNAs (30- and 24-nt) complementary to the FLC sense strand 3? to the polyA site. The small RNAs are most likely derived from an antisense transcript of FLC. Interacts with SOC1 and FT chromatin in vivo. Member of a protein complex.	protein_coding	FLOWERING LOCUS C (FLC)	FLOWERING LOCUS C (FLC);REDUCED STEM BRANCHING 6 (RSB6);AGAMOUS-LIKE 25 (AGL25);FLOWERING LOCUS F (FLF)	
AT4G28500	AT4G28500.1	NAC domain transcription factor involved in secondary cell wall biosynthesis.	protein_coding	NAC DOMAIN CONTAINING PROTEIN 73 (NAC073)	NAC DOMAIN CONTAINING PROTEIN 73 (ANAC073);SECONDARY WALL-ASSOCIATED NAC DOMAIN PROTEIN 2 (SND2);NAC DOMAIN CONTAINING PROTEIN 73 (NAC073)	
AT4G17460	AT4G17460.1	Encodes a class II HD-ZIP protein that regulates meristematic activity in different tissues; and that it is necessary for the correct formation of the gynoecium.	protein_coding	 (HAT1)	 (HAT1);JAIBA (JAB)	
