Locus Identifier	Gene Model Name	Gene Description	Gene Model Type	Primary Gene Symbol	All Gene Symbols
AT3G10800	AT3G10800.1	Encodes bZIP28; a putative membrane-tethered transcriptional factor. Up-regulated in response to heat; a bZIP28 null mutant has a heat-sensitive phenotype.  bZIP28 has a similar domain structure to the mammalian ATF6 protein involved in the unfolded protein response (UPR); and shares a bZIP domain; transmembrane domain; and a canonical S1P cleavage site. The bZIP28 seems to be glycosylated in vivo. bZIP28 does not appear to be transcriptionally up-regulated by UPR-inducing tunicamycin (TM) treatment. But; the expression level of three UPR-related genes is reduced in TM-treated zip28 mutants relative to wild type seedlings. And several UPR genes are transcriptionally upregulated when an N-terminal portion of the bZIP28 protein is expressed using the 35S promoter. A myc:bZIP28 fusion protein appears to be cleaved; likely at a canonical S2 cleavage site; following a TM treatment or a DTT stress-inducing treatment; but not a salt treatment. A portion of the  mGFP:bZIP28 protein present in root cells appears to translocate from the cytoplasm and ER to the nucleus following TM treatment. It is cleaved by S2P to allow translocation to the nucleus. The mRNA is cell-to-cell mobile.	protein_coding	 (BZIP28)	 (BZIP28)	
AT2G31220	AT2G31220.2	Encodes a bHLH transcription factor that together with bHLH089 and bHLH091 is important for the normal transcriptome of the developing Arabidopsis anther; possibly by forming a feed-forward loop with DYT1.	protein_coding			
AT2G24570	AT2G24570.1	member of WRKY Transcription Factor; Group II-d; negative regulator of basal resistance to Pseudomonas syringae.	protein_coding	WRKY DNA-BINDING PROTEIN 17 (WRKY17)	 (AtWRKY17);WRKY DNA-BINDING PROTEIN 17 (WRKY17)	
AT2G24260	AT2G24260.1	Encodes a basic helix-loop-helix (bHLH) protein that regulates root hair and sperm cell development.  One of the three Arabidopsis homologs of the Lotus japonicus ROOTHAIRLESS1 (LjRHL1) gene: At2g24260 (AtLRL1); At4g30980 (AtLRL2); and At5g58010 (AtLRL3).	protein_coding	LJRHL1-LIKE 1 (LRL1)	LJRHL1-LIKE 1 (LRL1);DEFECTIVE REGION OF POLLEN 1 (DROP1)	
AT2G42400	AT2G42400.1	VOZ transcription factor which acts as positive regulator of several salt-responsive genes. Functionally redundant in salt stress with VOZ1.	protein_coding	VASCULAR PLANT ONE ZINC FINGER PROTEIN 2 (VOZ2)	VASCULAR PLANT ONE ZINC FINGER PROTEIN 2 (VOZ2);VASCULAR PLANT ONE ZINC FINGER PROTEIN 2 (ATVOZ2)	
AT2G43010	AT2G43010.5	Isolated as a semidominant mutation defective in red -light responses. Encodes a nuclear localized  bHLH protein that interacts with active PhyB protein. Negatively regulates phyB mediated red light responses. Involved in shade avoidance response. Protein abundance is negatively regulated by PhyB.Involved in the regulation of response to nutrient levels. Controls the resistance to B. cinerea in a COI1- and EIN2-dependent manner.	protein_coding			
AT2G28550	AT2G28550.3	AP2 family transcription factor that is involved in regulation of flowering and innate immunity.Interacts with CRY2 to regulate CO and FT. TOE1 binds to activation domain of CO and binds CORE sequences of the FT promoter.TOE1/TOE2 are also targets of MiR172b and function in regulation of innate immunity.	protein_coding	RELATED TO AP2.7 (RAP2.7)	RELATED TO AP2.7 (RAP2.7)	
AT2G23290	AT2G23290.1	Member of the R2R3 factor gene family. Modulates seed germination and root  system development.	protein_coding	MYB DOMAIN PROTEIN 70 (MYB70)	MYB DOMAIN PROTEIN 70 (AtMYB70);MYB DOMAIN PROTEIN 70 (MYB70)	
AT2G32460	AT2G32460.1	Member of the R2R3 factor gene family.	protein_coding	MYB DOMAIN PROTEIN 101 (MYB101)	ARABIDOPSIS THALIANA MYB 1 (ATM1);ABNORMAL SHOOT 7 (ABS7); (ATMYB101);MYB DOMAIN PROTEIN 101 (MYB101);ABC TRANSPORTER OF THE MITOCHONDRION 1 (ATM1)	
AT2G24430	AT2G24430.1	NAC domain containing protein 38;(source:Araport11)	protein_coding	NAC DOMAIN CONTAINING PROTEIN 38 (NAC038)	NAC DOMAIN CONTAINING PROTEIN 38 (ANAC038);NAC DOMAIN CONTAINING PROTEIN 38 (NAC038)	
AT2G30340	AT2G30340.2	Lateral Organ Boundaries domain protein. LOB13 promotes lateral root formation. No significant transcriptional activation or repression activity was detected by the transient dual-luciferase assay (10.1111/tpj.16273).	protein_coding	LOB DOMAIN-CONTAINING PROTEIN 13 (LBD13)		
AT2G27300	AT2G27300.1	NTL8 is a membrane-associated NAC transcription factor that binds both TRY and TCL1. Overexpression results in fewer trichomes.	protein_coding	NTM1-LIKE 8 (NTL8)	ARABIDOPSIS NAC DOMAIN CONTAINING PROTEIN 40 (ANAC040);NTM1-LIKE 8 (NTL8)	
AT2G22540	AT2G22540.1	Encodes a nuclear protein that acts as a floral repressor and that functions within the thermosensory pathway.  SVP represses FT expression via direct binding to the vCArG III motif in the FT promoter.	protein_coding	SHORT VEGETATIVE PHASE (SVP)	SHORT VEGETATIVE PHASE (SVP);AGAMOUS-LIKE 22 (AGL22);FLOWERING ARABIDOPSIS QTL1 (FAQ1)	
AT2G25000	AT2G25000.1	Pathogen-induced transcription factor. Forms protein complexes with itself and with WRKY40. Coexpression with WRKY18 or WRKY40 made plants more susceptible to both  P. syringae and B. cinerea. WRKY18; WRKY40; and WRKY60 have partially redundant roles in response to the hemibiotrophic bacterial pathogen Pseudomonas syringae and the necrotrophic fungal pathogen Botrytis cinerea; with WRKY18 playing a more important role than the other two.	protein_coding	WRKY DNA-BINDING PROTEIN 60 (WRKY60)	WRKY DNA-BINDING PROTEIN 60 (WRKY60); (ATWRKY60)	
AT2G26960	AT2G26960.1	Member of the R2R3 factor gene family.Expressed in microspores and required for progression into pollen mitosis I.	protein_coding	MYB DOMAIN PROTEIN 81 (MYB81)	MYB DOMAIN PROTEIN 81 (AtMYB81);MYB DOMAIN PROTEIN 81 (MYB81)	
AT2G30250	AT2G30250.1	member of WRKY Transcription Factor; Group I. Located in nucleus. Involved in response to various abiotic stresses - especially salt stress.	protein_coding	WRKY DNA-BINDING PROTEIN 25 (WRKY25)	WRKY DNA-BINDING PROTEIN 25 (WRKY25); (AtWRKY25)	
AT2G22750	AT2G22750.3	basic helix-loop-helix (bHLH) DNA-binding superfamily protein;(source:Araport11)	protein_coding			
AT2G35530	AT2G35530.1	Encodes a G group bZIP transcription factor family member that can bind cis elements with an ACGT core; such as G-box; Hex; C-box and As-1.  The protein is localized in the nucleus and can homodimerize and can heterodimerize with other G group members.	protein_coding	BASIC REGION/LEUCINE ZIPPER TRANSCRIPTION FACTOR 16 (bZIP16)	BASIC REGION/LEUCINE ZIPPER TRANSCRIPTION FACTOR 16 (bZIP16); (AtbZIP16)	
AT3G10500	AT3G10500.1	Encodes a transcriptional activator that is associated with the plasma membrane in a dormant form and is proteolytically cleaved to create a form that can enter the nucleus.  It is thought to promote ROS production by binding directly to the promoters of genes encoding ROS biosynthetic enzymes during drought-induced leaf senescence. The mRNA is cell-to-cell mobile.	protein_coding	NAC DOMAIN CONTAINING PROTEIN 53 (NAC053)	NAC DOMAIN CONTAINING PROTEIN 53 (anac053);NAC DOMAIN CONTAINING PROTEIN 53 (NAC053);NAC WITH TRANSMEMBRANE MOTIF 1-LIKE 4 (NTL4);ANTHER INDEHISCENCE FACTOR (AIF)	
AT2G38300	AT2G38300.1	Transcription factor involved in wax biosynthesis; together with MYS2 acts upstream of the DEWAX-SPL9 module; thus regulating CER1 expression; regulates the diurnal expression pattern of DEWAX.	protein_coding	MYB-SHAQKYF 1 (MYS1)	MYB-SHAQKYF 1 (MYS1)	
AT2G23340	AT2G23340.1	encodes a member of the DREB subfamily A-5 of ERF/AP2 transcription factor family. The protein contains one AP2 domain. There are 16 members in this subfamily including RAP2.1; RAP2.9 and RAP2.10.	protein_coding	DREB AND EAR MOTIF PROTEIN 3 (DEAR3)	DREB AND EAR MOTIF PROTEIN 3 (DEAR3)	
AT3G10480	AT3G10480.3	Encodes a NAC transcription factor that physically associates with the histone H3K4 demethylase JMJ14 and through that association is involved in transcriptional repression and flowering time control. It binds the NAC-binding site; the Mitochondrial Dysfunction Motif.	protein_coding	NAC DOMAIN CONTAINING PROTEIN 50 (NAC050)	NAC DOMAIN CONTAINING PROTEIN 50 (ANAC050);NAC DOMAIN CONTAINING PROTEIN 50 (NAC050); (NAC50)	
AT2G43000	AT2G43000.1	Encodes a NAC transcription factor induced by hydrogen peroxide (H2O2). Involved in senescence. Over expression of the gene  strongly delays senescence and enhances tolerance to various abiotic stresses.	protein_coding	NAC DOMAIN CONTAINING PROTEIN 42 (NAC042)	NAC DOMAIN CONTAINING PROTEIN 42 (anac042);NAC DOMAIN CONTAINING PROTEIN 42 (NAC042);JUNGBRUNNEN 1 (JUB1); (ATJUB1)	
AT3G10030	AT3G10030.1	aspartate/glutamate/uridylate kinase family protein;(source:Araport11)	protein_coding			
AT4G06746	AT4G06746.1	encodes a member of the DREB subfamily A-5 of ERF/AP2 transcription factor family (RAP2.9). The protein contains one AP2 domain. There are 16 members in this subfamily including RAP2.1 and RAP2.10.	protein_coding	RELATED TO AP2 9 (RAP2.9)	RELATED TO AP2 9 (RAP2.9);DREB AND EAR MOTIF PROTEIN 5 (DEAR5)	
AT3G27785	AT3G27785.1	MYB118 encodes a myb transcription factor that represses endosperm maturation and; along with MYB115; regulates glucosinolate biosynthesis.	protein_coding	MYB DOMAIN PROTEIN 118 (MYB118)	MYB DOMAIN PROTEIN 118 (MYB118);PLANT GROWTH ACTIVATOR 37 (PGA37); (ATMYB118)	
AT3G59060	AT3G59060.2	Encodes a novel Myc-related bHLH transcription factor; which physically associated with APRR1/TOC1 and is a member of PIF3 transcription factor family. Involved in shade avoidance. Functions as negative regulator of PhyB. Protein levels are modulated by phytochrome B. Controls the resistance to B. cinerea in a COI1- and EIN2-dependent manner.	protein_coding	PHYTOCHROME INTERACTING FACTOR 3-LIKE 6 (PIL6)	PHYTOCHROME INTERACTING FACTOR 3-LIKE 6 (PIL6);PHYTOCHROME-INTERACTING FACTOR 5 (PIF5); (BHLHB1); (A-PUT2)	
AT3G21175	AT3G21175.1	member of a novel family of plant-specific GATA-type transcription factors.	protein_coding	ZIM-LIKE 1 (ZML1)	ZIM-LIKE 1 (ZML1);GATA TRANSCRIPTION FACTOR 24 (GATA24);ZIM LIKE 1 (ZML1); (TIFY2B)	
AT3G46070	AT3G46070.1	C2H2-type zinc finger family protein;(source:Araport11)	protein_coding			
AT3G58630	AT3G58630.1	sequence-specific DNA binding transcription factor;(source:Araport11)	protein_coding			
AT3G52440	AT3G52440.2	Dof-type zinc finger DNA-binding family protein;(source:Araport11)	protein_coding			
AT3G57920	AT3G57920.1	Encodes a putative transcriptional regulator that is involved in the vegetative to reproductive phase transition. Expression is regulated by MIR156b.	protein_coding	SQUAMOSA PROMOTER BINDING PROTEIN-LIKE 15 (SPL15)	SQUAMOSA PROMOTER BINDING PROTEIN-LIKE 15 (SPL15)	
AT3G49690	AT3G49690.1	Putative homolog of the Blind gene in tomato. Together with RAX1 and RAX3 belong to the class R2R3 MYB genes; encoded by the Myb-like transcription factor MYB84; regulates axillary meristem formation.	protein_coding	MYB DOMAIN PROTEIN 84 (MYB84)	 (SKI2);REGULATOR OF AXILLARY MERISTEMS3 (RAX3);MYB DOMAIN PROTEIN 84 (MYB84);MYB DOMAIN PROTEIN 84 (ATMYB84)	
AT3G58780	AT3G58780.4	One of two genes (SHP1 and SHP2) that are required for fruit dehiscence. The two genes control dehiscence zone differentiation and promote the lignification of adjacent cells.	protein_coding			
AT3G56850	AT3G56850.1	Encodes an ABA-responsive element binding protein with a bZIP domain. Located in the nucleus and expressed in the embryo during seed  maturation.	protein_coding	ABA-RESPONSIVE ELEMENT BINDING PROTEIN 3 (AREB3)	ABA-RESPONSIVE ELEMENT BINDING PROTEIN 3 (AREB3); (DPBF3)	
AT4G00250	AT4G00250.1	STKL2 is a DUF domain containing DNA binding protein that may be involved in mediating certain glucose responses. Binds to promoter of PGR; a putative plasma membrane glucose response regulator.	protein_coding	 (ATSTKL2)	 (ATSTKL2)	
AT4G00050	AT4G00050.1	Encodes a phytochrome interacting factor that    inhibits phytochrome A-mediated far-red light responses and binds to promoter regions of AT2G46970 and AT3G62090.	protein_coding	UNFERTILIZED EMBRYO SAC 10 (UNE10)	UNFERTILIZED EMBRYO SAC 10 (UNE10);PHYTOCHROME INTERACTING FACTOR 8 (PIF8)	
AT4G00270	AT4G00270.1	GeBP is a non canonical; nuclear localized leucine zipper transcription factor that binds G-elements.It is strongly expressed in the vegetative meristem and leaf primordium. It regulates genes down stream of a number of signaling pathways including hormone and defense responses.	protein_coding	GL1 ENHANCER BINDING PROTEIN (GeBP)	GL1 ENHANCER BINDING PROTEIN (GeBP);STOREKEEPER RELATED 1 (STKR1)	
AT3G49530	AT3G49530.1	Transcription factor that serves as a molecular link between cold signals and pathogen resistance  responses.  Undergoes proteolytic processing triggered by cold-induced changes in membrane fluidity.It relocates from the plasma membrane to the nucleus in response to ER stress. NAC062 is phosphorylated by SnRK2.8 at Thr-142.	protein_coding	NAC DOMAIN CONTAINING PROTEIN 62 (NAC062)	NAC DOMAIN CONTAINING PROTEIN 62 (ANAC062);NTM1 (NAC WITH TRANSMEMBRANE MOTIF 1)-LIKE 6 (NTL6);NAC DOMAIN CONTAINING PROTEIN 62 (NAC062)	
AT3G50410	AT3G50410.1	Arabidopsis Dof protein containing a single 51-amino acid zinc finger DNA-binding domain; which may play an important roles in plant growth and development.	protein_coding	OBF BINDING PROTEIN 1 (OBP1)	DOF PROTEIN 3.4 (DOF3.4);OBF BINDING PROTEIN 1 (OBP1)	
AT3G51080	AT3G51080.1	Encodes a member of the GATA factor family of zinc finger transcription factors.	protein_coding	GATA TRANSCRIPTION FACTOR 6 (GATA6)	GATA TRANSCRIPTION FACTOR 6 (GATA6)	
AT3G57230	AT3G57230.1	MADS-box transcription factor. Expressed in leaf; root and stem; with higher RNA accumulation in guard cells and trichomes. AGL16 can directly interact with SVP and indirectly interact with FLC. Furthermore; the accumulation of AGL16 transcripts is modulated by miR824 (AT4G24415). The flowering time effect for the miR824/AGL16 module is more obvious in the Col-FRI background than in the Col-0 background. AGL16 controls flowering via an allelic dosage effect in long-day non-vernalized conditions.AGL16 binds to promoters of over 2000 genes with CArG-box motifs. Forms a complex with SOC1 and regulates its expression;=.	protein_coding	AGAMOUS-LIKE 16 (AGL16)	AGAMOUS-LIKE 16 (AGL16)	
AT3G49930	AT3G49930.1	C2H2 and C2HC zinc fingers superfamily protein;(source:Araport11)	protein_coding			
AT3G55370	AT3G55370.3	Encodes a nuclear localized Dof domain containing transcription factor expressed primarily in roots. Responsive to salicylic acid. Transgenic overexpressors have yellow leaves and short; defective roots.	protein_coding	OBF-BINDING PROTEIN 3 (OBP3)	OBF-BINDING PROTEIN 3 (OBP3)	
AT3G53200	AT3G53200.1	Member of the R2R3 factor gene family.	protein_coding	MYB DOMAIN PROTEIN 27 (MYB27)	MYB DOMAIN PROTEIN 27 (AtMYB27);MYB DOMAIN PROTEIN 27 (MYB27)	
AT3G60580	AT3G60580.1	C2H2-like zinc finger protein;(source:Araport11)	protein_coding	 (ZAT9)	 (ZAT9)	
AT3G60530	AT3G60530.1	Encodes a member of the GATA factor family of zinc finger transcription factors.	protein_coding	GATA TRANSCRIPTION FACTOR 4 (GATA4)	GATA TRANSCRIPTION FACTOR 4 (GATA4)	
AT4G04450	AT4G04450.1	Member of WRKY Transcription Factor; Group II-b. Interacts with lncRNA APOLO to trigger root hair cell expansion in response to cold.Regulates expression of genes involved in leaf senescence.	protein_coding	 (WRKY42)	 (WRKY42); (AtWRKY42)	
AT4G11660	AT4G11660.1	member of Heat Stress Transcription Factor (Hsf) family	protein_coding	 (AT-HSFB2B)	 (AT-HSFB2B); (HSF7);HEAT SHOCK TRANSCRIPTION FACTOR  B2B (HSFB2B)	
AT3G46640	AT3G46640.3	Encodes a myb family transcription factor with a single Myb DNA-binding domain (type SHAQKYF) that is unique to plants and is essential for circadian rhythms; specifically for transcriptional regulation within the circadian clock.   LUX is required for normal rhythmic expression of multiple clock outputs in both constant light and darkness.  It is coregulated with TOC1 and seems to be repressed by CCA1 and LHY by direct binding of these proteins to the evening element in the LUX promoter. The mRNA is cell-to-cell mobile.	protein_coding	PHYTOCLOCK 1 (PCL1)	PHYTOCLOCK 1 (PCL1)	
AT3G46090	AT3G46090.1	C2H2 and C2HC zinc fingers superfamily protein;(source:Araport11)	protein_coding	 (ZAT7)	 (ZAT7)	
AT3G57600	AT3G57600.1	encodes a member of the DREB subfamily A-2 of ERF/AP2 transcription factor family. The protein contains one AP2 domain. There are eight members in this subfamily including DREB2A AND DREB2B that are involved in response to drought.	protein_coding			
AT3G47620	AT3G47620.1	Encodes a transcription factor AtTCP14 that regulates seed germination.  AtTCP14 shows elevated expression level just prior to germination.  AtTCP14 is predominantly expressed in the vascular tissue of the embryo; and affects gene expression in radicles in a non-cell-autonomous manner. Modulates GA-dependent stamen filament elongation by direct activation of SAUR63 subfamily genes through conserved target sites in their promoters. Promotes together with TCP8; 7 and 15 endoreduplication-dependent cell expansion in leaf.	protein_coding	TEOSINTE BRANCHED, CYCLOIDEA AND PCF (TCP) 14 (TCP14)	TEOSINTE BRANCHED, CYCLOIDEA AND PCF (TCP) 14 (AtTCP14);TEOSINTE BRANCHED, CYCLOIDEA AND PCF (TCP) 14 (TCP14)	
AT3G61910	AT3G61910.1	NAC transcription factor NST2. NST1 and NST2 are redundant in regulating secondary wall thickening  in anther walls. NST2 promoter was particularly strong in anther tissue.	protein_coding	NAC DOMAIN PROTEIN 66 (NAC066)	NAC  SECONDARY WALL THICKENING PROMOTING FACTOR2 (NST2);NAC DOMAIN PROTEIN 66 (ANAC066);NAC DOMAIN PROTEIN 66 (NAC066)	
AT3G61890	AT3G61890.1	Encodes a homeodomain leucine zipper class I (HD-Zip I) protein. Loss of function mutant has abnormally shaped leaves and stems.	protein_coding	HOMEOBOX 12 (HB-12)	HOMEOBOX 12 (ATHB-12);ARABIDOPSIS THALIANA HOMEOBOX 12 (ATHB12);HOMEOBOX 12 (HB-12);HOMEOBOX 12 (HB12)	
AT3G25730	AT3G25730.1	ethylene response DNA binding factor 3;(source:Araport11)	protein_coding	ETHYLENE RESPONSE DNA BINDING FACTOR 3 (EDF3)	ETHYLENE RESPONSE DNA BINDING FACTOR 3 (EDF3)	
AT3G15030	AT3G15030.1	Arabidopsis thaliana TCP family transcription factor. Regulated by miR319. Involved in heterchronic regulation of leaf differentiation. Promotes hypocotyl elongation when hyperactivated. Enhance hypocotyl cell elongation by directly activating YUC5.	protein_coding	TCP FAMILY TRANSCRIPTION FACTOR 4 (TCP4)	TCP FAMILY TRANSCRIPTION FACTOR 4 (TCP4);MATERNAL EFFECT EMBRYO ARREST 35 (MEE35); (PCF4)	
AT3G25990	AT3G25990.1	Homeodomain-like superfamily protein;(source:Araport11)	protein_coding			
AT3G27010	AT3G27010.1	Belongs to a TCP protein transcription factor family. Members of this family contain a predicted basic-helix-loop-helix domain involved in DNA binding. Related to rice PCF1 and PCF2 genes. Binds to the GCCCR element of CYCB1;1. Involved in regulation of expression of cell cycle control and ribosomal protein genes. Inhibits pavement cell size without affecting leaf size.	protein_coding	TEOSINTE BRANCHED 1, CYCLOIDEA, PCF (TCP)-DOMAIN FAMILY PROTEIN 20 (TCP20)	 (PCF1);TEOSINTE BRANCHED 1, CYCLOIDEA, PCF (TCP)-DOMAIN FAMILY PROTEIN 20 (TCP20); (ATTCP20);ARABIDOPSIS THALIANA TEOSINTE BRANCHED 1, CYCLOIDEA, PCF (TCP)-DOMAIN FAMILY PROTEIN 20 (AT-TCP20)	
AT3G30530	AT3G30530.1	basic leucine-zipper 42;(source:Araport11)	protein_coding	BASIC LEUCINE-ZIPPER 42 (bZIP42)	BASIC LEUCINE-ZIPPER 42 (ATBZIP42);BASIC LEUCINE-ZIPPER 42 (bZIP42)	
AT3G62420	AT3G62420.1	Encodes a group-S bZIP transcription factor. Forms heterodimers with group-C bZIP transcription factors. The heterodimers bind to the ACTCAT cis-element of proline dehydrogenase gene.	protein_coding	BASIC REGION/LEUCINE ZIPPER MOTIF 53 (BZIP53)	BASIC REGION/LEUCINE ZIPPER MOTIF 53 (BZIP53);BASIC REGION/LEUCINE ZIPPER MOTIF 53 (ATBZIP53)	
AT3G61120	AT3G61120.1	Encodes AGL13; a member of the AGL6 clade of the MADS-box gene family. Expressed in both pollen and ovules. Functions in male and female gametophyte morphogenesis.	protein_coding	AGAMOUS-LIKE 13 (AGL13)	AGAMOUS-LIKE 13 (AGL13)	
AT3G61150	AT3G61150.1	Encodes a homeobox-leucine zipper family protein belonging to the HD-ZIP IV family.	protein_coding	HOMEODOMAIN GLABROUS 1 (HDG1)	HOMEODOMAIN GLABROUS 1 (HDG1);HOMEODOMAIN-GLABRA2 1 (HD-GL2-1)	
AT3G56400	AT3G56400.1	Member of WRKY Transcription Factor; Group III. Function as activator of SA-dependent defense genes and a repressor of JA-regulated genes. WRKY70-controlled suppression of  JA-signaling is partly executed by NPR1.	protein_coding	WRKY DNA-BINDING PROTEIN 70 (WRKY70)	WRKY DNA-BINDING PROTEIN 70 (WRKY70);ARABIDOPSIS THALIANA WRKY DNA-BINDING PROTEIN 70 (ATWRKY70)	
AT3G48430	AT3G48430.1	Relative of Early Flowering 6 (REF6) encodes a Jumonji N/C and zinc finger domain-containing protein that acts as a positive regulator of flowering in an FLC-dependent pathway. REF6 mutants have hyperacetylation of histone H4 at the FLC locus. REF6 interacts with BES1 in a Y2H assay and in vitro. REF6 may play a role in brassinoteroid signaling by affecting histone methylation in the promoters of BR-responsive genes. It is most closely related to the JHDM3 subfamily of JmjN/C proteins. The mRNA is cell-to-cell mobile.	protein_coding	RELATIVE OF EARLY FLOWERING 6 (REF6)	ETHYLENE INSENSITIVE 6 (EIN6);RELATIVE OF EARLY FLOWERING 6 (REF6);JUMONJI DOMAIN-CONTAINING PROTEIN 12 (JMJ12); (EIN6)	
AT4G05100	AT4G05100.1	Member of the R2R3 factor gene family. Indole-3-Acetamide-Induced transcription Factor; decreases plant growth and contributes to the control of osmotic stress responses.	protein_coding	MYB DOMAIN PROTEIN 74 (MYB74)	MYB DOMAIN PROTEIN 74 (AtMYB74);MYB DOMAIN PROTEIN 74 (MYB74)	
AT4G01550	AT4G01550.1	Encodes a plasma-membrane bound NAC transcription factor; whose controlled proteolytic activation allows it to enter the nucleus.	protein_coding	NAC DOMAIN CONTAINING PROTEIN 69 (NAC069)	NAC DOMAIN CONTAINING PROTEIN 69 (anac069);NAC DOMAIN CONTAINING PROTEIN 69 (NAC069);NAC WITH TRANSMEMBRANE MOTIF 2 (NTM2); (NTL13)	
AT4G01680	AT4G01680.2	Encodes a putative transcription factor (MYB55).	protein_coding	MYB DOMAIN PROTEIN 55 (MYB55)	MYB DOMAIN PROTEIN 55 (MYB55)	
AT3G47600	AT3G47600.1	Encodes a putative transcription factor (MYB94).	protein_coding	MYB DOMAIN PROTEIN 94 (MYB94)	MYB DOMAIN PROTEIN 94 (MYB94); (ATMYBCP70);MYB DOMAIN PROTEIN 94 (ATMYB94)	
AT3G47500	AT3G47500.1	Dof-type zinc finger domain-containing protein; identical to H-protein promoter binding factor-2a GI:3386546 from (Arabidopsis thaliana). Interacts with LKP2 and FKF1; but its overexpression does not change flowering time under short or long day conditions.	protein_coding	CYCLING DOF FACTOR 3 (CDF3)	CYCLING DOF FACTOR 3 (CDF3)	
AT3G51060	AT3G51060.1	A member of SHI gene family. Arabidopsis thaliana has ten members that encode proteins with a RING finger-like zinc finger motif. Despite being highly divergent in sequence; many of the SHI-related genes are partially redundant in function and synergistically promote gynoecium; stamen and leaf development in Arabidopsis. STY1/STY2 double mutants showed defective style; stigma as well as serrated leaves. Binds to the promoter of YUC4 and YUC8 (binding site  ACTCTAC)	protein_coding	STYLISH 1 (STY1)	STYLISH 1 (STY1);SHI RELATED SEQUENCE 1 (SRS1); (ATSTY1)	
AT3G50060	AT3G50060.1	Encodes a member of the R2R3 transcription factor gene family. Expressed in response to potassium deprivation and auxin. Involved in lateral root development. Interacts with ARF7 and regulates the expression of some auxin responsive genes.	protein_coding	MYB DOMAIN PROTEIN 77 (MYB77)	MYB DOMAIN PROTEIN 77 (MYB77)	
AT3G54990	AT3G54990.1	Encodes a AP2 domain transcription factor that can repress flowering. SMZ and its paralogous gene; SNARCHZAPFEN (SNZ);  share a signature with partial complementarity to the miR172 microRNA; whose precursor is induced upon flowering.	protein_coding	SCHLAFMUTZE (SMZ)	SCHLAFMUTZE (SMZ)	
AT3G45610	AT3G45610.1	PEAR protein involved in the formation of a short-range concentration gradient that peaks at protophloem sieve elements; and activates gene expression that promotes radial growth. Locally promotes transcription of inhibitory HD-ZIP III genes; and thereby establishes a negative-feedback loop that forms a robust boundary that demarks the zone of cell division.	protein_coding	DOF TRANSCRIPTION FACTOR 6 (DOF6)	DOF TRANSCRIPTION FACTOR 6 (DOF6)	
AT3G17730	AT3G17730.1	NAC domain containing protein 57;(source:Araport11)	protein_coding	NAC DOMAIN CONTAINING PROTEIN 57 (NAC057)	NAC DOMAIN CONTAINING PROTEIN 57 (anac057);NAC DOMAIN CONTAINING PROTEIN 57 (NAC057)	
AT3G12910	AT3G12910.1	NAC (No Apical Meristem) domain transcriptional regulator superfamily protein;(source:Araport11)	protein_coding			
AT3G22170	AT3G22170.1	A component of the PHYA signaling network; mediates the FR-HIR response to far-red light in concert with FAR1. Expression is induced by age; involved in negative regulation of leaf senescence.	protein_coding	FAR-RED ELONGATED HYPOCOTYLS 3 (fhy3)	FAR-RED ELONGATED HYPOCOTYLS 3 (fhy3);CHLOROPLAST DIVISION MUTANT 45 (CPD45)	
AT3G26620	AT3G26620.1	LOB domain-containing protein 23;(source:Araport11)	protein_coding	LOB DOMAIN-CONTAINING PROTEIN 23 (LBD23)	LOB DOMAIN-CONTAINING PROTEIN 23 (LBD23)	
