Locus Identifier	Gene Model Name	Gene Description	Gene Model Type	Primary Gene Symbol	All Gene Symbols
AT1G46768	AT1G46768.1	encodes a member of the DREB subfamily A-5 of ERF/AP2 transcription factor family (RAP2.1). The protein contains one AP2 domain. There are 16 members in this subfamily including RAP2.9 and RAP2.10.	protein_coding	RELATED TO AP2 1 (RAP2.1)	RELATED TO AP2 1 (RAP2.1)	
AT1G45249	AT1G45249.6	Leucine zipper transcription factor that binds to the abscisic acid (ABA)?responsive element (ABRE) motif in the promoter region of ABA-inducible genes. Enhances drought tolerance in vegetative tissues. Required for normal glucose response. Localized in the nucleus.  Expressed constitutively in roots;  leaf vascular tissues; and hydathodes or  in all tissues under stress conditions. It Primes phosphorylated by a ABA-activated 42-KDa kinase. Overexpression of the phosphorylated active form of AREB1 expressed many ABA-inducible genes; such as RD29B; without ABA treatment.	protein_coding			
AT1G46264	AT1G46264.1	Encodes SCHIZORIZA; a member of Heat Shock Transcription Factor (Hsf) family. Functions as a nuclear factor regulating asymmetry of stem cell divisions.	protein_coding	HEAT SHOCK TRANSCRIPTION FACTOR  B4 (HSFB4)	 (AT-HSFB4);HEAT SHOCK TRANSCRIPTION FACTOR  B4 (HSFB4);SCHIZORIZA (SCZ)	
AT1G47655	AT1G47655.1	Dof-type zinc finger DNA-binding family protein;(source:Araport11)	protein_coding			
AT1G14687	AT1G14687.1	homeobox protein 32;(source:Araport11)	protein_coding	HOMEOBOX PROTEIN 32 (HB32)	HOMEOBOX PROTEIN 32 (AtHB32);ZINC FINGER HOMEODOMAIN 14 (ZHD14);HOMEOBOX PROTEIN 32 (HB32)	
AT1G49010	AT1G49010.1	Duplicated homeodomain-like superfamily protein;(source:Araport11)	protein_coding	 (MYBS1)	 (MYBS1)	
AT1G08320	AT1G08320.1	bZIP transcription factor family protein;(source:Araport11)	protein_coding	TGACG (TGA) MOTIF-BINDING PROTEIN 9 (TGA9)	 (bZIP21);TGACG (TGA) MOTIF-BINDING PROTEIN 9 (TGA9)	
AT1G50640	AT1G50640.1	encodes a member of the ERF (ethylene response factor) subfamily B-1 of ERF/AP2 transcription factor family (ATERF-3). The protein contains one AP2 domain. There are 15 members in this subfamily including ATERF-3; ATERF-4; ATERF-7; and leafy petiole.	protein_coding	ETHYLENE RESPONSIVE ELEMENT BINDING FACTOR 3 (ERF3)	ETHYLENE RESPONSIVE ELEMENT BINDING FACTOR 3 (ERF3); (ATERF3)	
AT1G35460	AT1G35460.1	Encodes a bHLH transcription factor involved in CFL1-mediated regulation of cuticle development. Overexpression leads to abnormal cuticle development.	protein_coding	FLOWERING BHLH 1 (FBH1)	FLOWERING BHLH 1 (FBH1);ATCFL1 ASSOCIATED PROTEIN 2 (CFLAP2)	
AT1G34190	AT1G34190.1	Encodes a NAC domain transcription factor that regulates the mitochondrial retrograde response and coordinates organellar functions and stress responses.	protein_coding	NAC DOMAIN CONTAINING PROTEIN 17 (NAC017)	NAC DOMAIN CONTAINING PROTEIN 17 (anac017);NAC DOMAIN CONTAINING PROTEIN 17 (NAC017);REGULATORS OF AOX1A 2 (RAO2)	
AT1G51700	AT1G51700.1	Encodes dof zinc finger protein (adof1). The mRNA is cell-to-cell mobile.	protein_coding	DOF ZINC FINGER PROTEIN 1 (DOF1)	DOF ZINC FINGER PROTEIN 1 (ADOF1);DOF ZINC FINGER PROTEIN 1 (DOF1)	
AT1G29860	AT1G29860.1	Encodes a member of WRKY Transcription Factor; Group II-c that mediates ethylene signaling and synthesis to hasten leaf senescence.	protein_coding	WRKY DNA-BINDING PROTEIN 71 (WRKY71)	WRKY DNA-BINDING PROTEIN 71 (WRKY71);WRKY DNA-BINDING PROTEIN 71 (ATWRKY71);EXCESSIVE BRANCHES1 (EXB1)	
AT1G34180	AT1G34180.2	NAC domain containing protein 16;(source:Araport11)	protein_coding	NAC DOMAIN CONTAINING PROTEIN 16 (NAC016)	NAC DOMAIN CONTAINING PROTEIN 16 (anac016);NAC DOMAIN CONTAINING PROTEIN 16 (NAC016)	
AT1G31140	AT1G31140.2	Encodes a B-sister MADS-box protein; GORDITA which is specific to the Brassicaceae. GOA is the most closely related paralog of ABS. GOA represses fruit growth and contributes to integument development.  Over-expression of GOA results in disorganized floral structure and addition of carpel-like  features to sepals.	protein_coding	GORDITA (GOA)	GORDITA (GOA)	
AT1G34370	AT1G34370.1	Encodes a putative nuclear Cys(2)His(2)-type zinc finger protein involved in H+ and Al3+ rhizotoxicity.  In mutants exposed to aluminum stress; there is no induction of AtALMT1; an malate transporter known to be involved in the mediation of aluminum toxicity. Cell wall of the mutant is unstable in low pH medium (pH 4.5) in low Ca solution. This would mediate Ca-alleviation of low pH stress through pectin-Ca interaction. In vitro binding and mutated-promoter-GUS assays identified that STOP1 directly activates AtALMT1 expression through the binding to the promoter by four zinc finger domains. Binding of STOP1 to promoter is an essential step of Al-inducible AtALMT1 expression. The mRNA is cell-to-cell mobile.	protein_coding	SENSITIVE TO PROTON RHIZOTOXICITY 1 (STOP1)	 (ATSTOP1);SENSITIVE TO PROTON RHIZOTOXICITY 1 (STOP1)	
AT1G12630	AT1G12630.1	encodes a member of the DREB subfamily A-4 of ERF/AP2 transcription factor family. The protein contains one AP2 domain. There are 17 members in this subfamily including TINY.	protein_coding			
AT1G47870	AT1G47870.1	Member of the E2F transcription factors; (cell cycle genes); key components of the cyclin D/retinoblastoma/E2F pathway.  AtE2Fc is regulated by a balance between gene expression and ubiquitin-proteasome proteolysis.  AtE2Fc might play a role in cell division and during the transition from skotomorphogenesis to photomorphogenesis. E2Fc has been shown to interact with DPB in its nonphosphorylated form; when E2Fc is phosphorylated; the formation of the E2Fc/DPB heterodimer is lost. E2Fc is required for miR396 activity on cell proliferation under UV-B.  Its role is independent of E2Fe; probably modulating DNA damage responses through the regulation of SOG1 and ATR transcript levels.	protein_coding	 (ATE2F2)	 (E2FC);ARABIDOPSIS THALIANA HOMOLOG OF E2F C (ATE2FC); (ATE2F2)	
AT1G30650	AT1G30650.1	Encodes a member of the WRKY Transcription Factor family; Group II-e. It plays critical roles in the repression  of plant thermomorphogenesis. WRKY14 represses expression of PIF4 at the transcriptional level; as well as the transactivation activity of the PIF4-TCP5 complex at the protein level; by interacting with TCP5 during plant thermomorphogenesis.	protein_coding	WRKY DNA-BINDING PROTEIN 14 (WRKY14)	 (AR411);WRKY DNA-BINDING PROTEIN 14 (ATWRKY14);WRKY DNA-BINDING PROTEIN 14 (WRKY14);ABNORMAL THERMOMORPHOGENESIS 1 (ABT1)	
AT1G08000	AT1G08000.1	Encodes a member of the GATA factor family of zinc finger transcription factors.	protein_coding	GATA TRANSCRIPTION FACTOR 10 (GATA10)	GATA TRANSCRIPTION FACTOR 10 (GATA10)	
AT1G51220	AT1G51220.1	Encodes a WIP domain containing protein. Putative target of WRKY53.WIP5 is a paralog of NTT and along with WIP4;acts redundantly in cell fate determination during primary root development. MP binds to AuxRE motifs within the WIP5 gene and likely regulates its expression.	protein_coding	WIP DOMAIN PROTEIN 5 (WIP5)	WIP DOMAIN PROTEIN 5 (WIP5); (AtWIP5)	
AT1G42990	AT1G42990.1	bZIP60 consists of a bZIP DNA binding domain followed by a putative transmembrane domain. bZIP60 mRNA is upregulated by the addition of ER stress inducers; tunicamycin (inhibitor of N-linked glycosylation); DTT (inhibitor of disulfide bond formation) and azetin-2-carboxylate (proline analog perturbing protein structure). Upon ER stress; bZIP60 mRNA is spliced by IRE1A and IRE1B to produce bZIP60-S; an active transcription factor without the transmembrane domain. bZIP60-U; a product of unspliced form of bZIP60 mRNA; is localized at the ER membrane and bZIP60-S is localized in the nucleus.	protein_coding	BASIC REGION/LEUCINE ZIPPER MOTIF 60 (BZIP60)	BASIC REGION/LEUCINE ZIPPER MOTIF 60 (ATBZIP60);BBASIC REGION/LEUCINE ZIPPER MOTIF 60 (BZIP60);BASIC REGION/LEUCINE ZIPPER MOTIF 60 (BZIP60)	
AT1G49480	AT1G49480.1	Encodes a nuclear-localized DNA-binding protein that interacts with ITN1 at the PM and nuclei in vivo and may regulate ITN's subcellular localization.	protein_coding	RELATED TO VERNALIZATION1 1 (RTV1)	RELATED TO VERNALIZATION1 1 (RTV1)	
AT1G34670	AT1G34670.1	Encodes a member of the R2R3 transcription factor gene family that is a negative regulator of lateral root (LR) development. It has been proposed that this transcription factor is part of a novel negative feedback loop stimulated specifically in the endodermis upon LR initiation to ensure that LRs are formed only in the correct place.	protein_coding	MYB DOMAIN PROTEIN 93 (MYB93)	MYB DOMAIN PROTEIN 93 (AtMYB93);MYB DOMAIN PROTEIN 93 (MYB93)	
AT1G08810	AT1G08810.1	putative transcription factor of the R2R3-MYB gene family. Transcript increases under conditions that promote stomatal opening (white and blue light; abi1-1 mutation) and decreases under conditions that trigger stomatal closure (ABA; desiccation; darkness); with the exception of elevated CO2. Expressed exclusively in guard cells of all tissues. It is required for light-induced opening of stomata. Mutant shows reduced stomatal aperture which helps to limit water loss during drought.	protein_coding	MYB DOMAIN PROTEIN 60 (MYB60)	MYB DOMAIN PROTEIN 60 (MYB60);MYB DOMAIN PROTEIN 60 (AtMYB60)	
AT1G51140	AT1G51140.1	Encodes a basic helix-loop-helix-type transcription factor involved in photoperiodism flowering. Binds to the E-box cis-element in the CONSTANS (CO) promoter to regulate flowering. Interacts with CFL1 and along with CFLAP2 negatively regulates cuticle development.  Binds to the potassium channel gene KAT1 as a dimer. The DNA-binding capacity is inhibited in response to ABA through phosphorylation-dependent monomerization.	protein_coding	FLOWERING BHLH 3 (FBH3)	FLOWERING BHLH 3 (FBH3);ABA-RESPONSIVE KINASE SUBSTRATE 1 (AKS1);ATCFL1 ASSOCIATED PROTEIN 1 (CFLAP1)	
AT1G29160	AT1G29160.1	Encodes a DOF transcription factor involved in seed coat development. Regulates PRX2 and PRX25; involved in seed longevity.	protein_coding	COGWHEEL1 (COG1)	COGWHEEL1 (COG1)	
AT1G17950	AT1G17950.1	R2R3-MYB transcription family. Absence of the MYB52 transcription factor is correlated with an increase in PME activity and a decrease in the degree of pectin methylesterification. Transcriptionally activates PECTIN METHYLESTERASE INHIBITOR6 (PMEI6); PMEI14; and SUBTILISIN-LIKE SER PROTEASE1.7 (SBT1.7) by binding to their promoters. MYB52 can bind to the same regulatory regions as the ERF4 transcriptional represssor.	protein_coding	MYB DOMAIN PROTEIN 52 (MYB52)	MYB DOMAIN PROTEIN 52 (ATMYB52); (BW52);MYB DOMAIN PROTEIN 52 (MYB52)	
AT1G49950	AT1G49950.1	Encodes a telomeric DNA binding protein and Single Myb Histone (SMH) gene family member. In vitro; an N-terminal Myb domain enables it to interact with double-stranded telomeric repeats.Mutations in TRB1 and TRB3 enhance the lhp1 mutant phenotype. Triple mutants are more strongly affected than the respective double mutants with lhp1. TRB1 binds non-H3K27me3 target genes predominantly at the transcription start sites and its presence increases the expression of several of these targets; enriched for functions of primary metabolism. At H3K27me3 target genes; TRB1 binding is more distributed across gene bodies and at extended promoter regions; corresponding to an enrichment of putative binding sites "RMCCTAR". At these genes; TRB1 particiaptes in the repression because several direct targets are further upregulated in trb1 lhp1 double mutants as compared to lhp1 mutants.	protein_coding	TELOMERE REPEAT BINDING FACTOR 1 (TRB1)	TELOMERE REPEAT BINDING FACTOR 1 (TRB1);TELOMERE REPEAT BINDING FACTOR 1 (ATTRB1)	
AT1G25340	AT1G25340.3	putative transcription factor (MYB116)	protein_coding			
AT1G32510	AT1G32510.1	NAC domain containing protein 11;(source:Araport11)	protein_coding	NAC DOMAIN CONTAINING PROTEIN 11 (NAC011)	NAC DOMAIN CONTAINING PROTEIN 11 (ANAC011);NAC DOMAIN CONTAINING PROTEIN 11 (NAC011)	
AT1G32770	AT1G32770.1	Encodes SND1; a NAC Domain transcription factor involved in secondary wall biosynthesis in fibers. Expressed specifically in interfascicular fibers and xylary fibers in stems. Expressed in the procambium of stem inflorescences and root. May act as a negative regulator of secondary wall thickening in xylary fibers. Acts redundantly with NST1 to control development of secondary walls in siliques.	protein_coding	NAC DOMAIN CONTAINING PROTEIN 12 (NAC012)	NAC DOMAIN CONTAINING PROTEIN 12 (ANAC012);SECONDARY WALL-ASSOCIATED NAC DOMAIN 1 (SND1);NAC SECONDARY WALL THICKENING PROMOTING 3 (NST3);NAC DOMAIN CONTAINING PROTEIN 12 (NAC012); (ATSND1)	
AT1G09030	AT1G09030.1	nuclear factor Y; subunit B4;(source:Araport11)	protein_coding	NUCLEAR FACTOR Y, SUBUNIT B4 (NF-YB4)	NUCLEAR FACTOR Y, SUBUNIT B4 (NF-YB4)	
AT1G02065	AT1G02065.1	Encodes an SBP-box gene; a member of the SPL gene family. Mutants are affected in micro- and megasporogenesis; trichome formation on sepals; and stamen filament elongation.	protein_coding	SQUAMOSA PROMOTER BINDING PROTEIN-LIKE 8 (SPL8)	SQUAMOSA PROMOTER BINDING PROTEIN-LIKE 8 (SPL8)	
AT1G12610	AT1G12610.1	Encodes a member of the DREB subfamily A-1 of ERF/AP2 transcription factor family (DDF1). The protein contains one AP2 domain. There are six members in this subfamily; including CBF1; CBF2; and CBF3. Overexpression of this gene results in delayed flowering and dwarfism; reduction of gibberellic acid biosynthesis; and increased tolerance to high levels of salt. This gene is expressed in all tissues examined; but most abundantly expressed in upper stems. Overexpression of this gene is also correlated with increased expression of GA biosynthetic genes and RD29A (a cold and drought responsive gene). Under salt stress it induces the expression of GAOX7; which encodes ad C20-GA inhibitor.	protein_coding	DWARF AND DELAYED FLOWERING 1 (DDF1)	DWARF AND DELAYED FLOWERING 1 (ATDDF1);DWARF AND DELAYED FLOWERING 1 (DDF1)	
AT1G44830	AT1G44830.1	Encodes a nuclear-localized member of the DREB subfamily A-5 of ERF/AP2 transcription factor family. The protein contains one AP2 domain. There are 15 members in this subfamily including RAP2.1; RAP2.9 and RAP2.10.  Overexpression in cultured cells results in an increase in pectin deposition.ERF014 differentially regulates responses to bacterial and fungal  pathogens.	protein_coding	ERF TRANSCRIPTION FACTOR 14 (ERF014)	 (ATERF014);ERF GENE CONFERRING POSTHARVEST LONGEVITY IMPROVEMENT 1 (EPI1);ERF TRANSCRIPTION FACTOR 14 (ERF014)	
AT1G33240	AT1G33240.1	Encodes a plant transcriptional activator that contains two separate; but similar; trihelix DNA-binding domains; similar to GT-2. Gene is expressed in all aerial parts of the plant; with higher level of expression in siliques. At-GTL2 was thought to be a duplicated copy of this gene but is likely to be a cloning artefact; the result of a chimeric clone.  Regulates ploidy-dependent cell growth in trichome.	protein_coding	GT-2-LIKE 1 (GTL1)	GT2-LIKE 1 (AT-GTL1); (ATGTL1);GT-2-LIKE 1 (GTL1);GT2-LIKE 2 (AT-GTL2)	
AT1G06070	AT1G06070.1	Basic-leucine zipper (bZIP) transcription factor family protein;(source:Araport11)	protein_coding	BASIC LEUCINE-ZIPPER 69 (BZIP69)	BASIC LEUCINE-ZIPPER 69 (BZIP69)	
AT1G02250	AT1G02250.1	Encodes a member of the NAC family of transcription factors. ANAC005 contains sequences specifying both nuclear and plasma membrane targeting. Overexpression results in increased xylem differentiation suggesting ANAC005 promotes xylem formation.	protein_coding	NAC DOMAIN CONTAINING PROTEIN 5 (NAC005)	NAC DOMAIN CONTAINING PROTEIN 5 (NAC005);NAC DOMAIN CONTAINING PROTEIN 5 (anac005)	
AT1G49560	AT1G49560.1	Homeodomain-like superfamily protein;(source:Araport11)	protein_coding	HRS1 HOMOLOG6 (HHO6)	HRS1 HOMOLOG6 (HHO6)	
AT1G49720	AT1G49720.2	Identified as a protein that binds to abscisic acid response elements. May mediate transcriptional regulation of ABA responses.	protein_coding	ABSCISIC ACID RESPONSIVE ELEMENT-BINDING FACTOR 1 (ABF1)	 (ATABF1);ABSCISIC ACID RESPONSIVE ELEMENT-BINDING FACTOR 1 (ABF1)	
AT1G27360	AT1G27360.1	In conjunction with SPL10 and SPL2; SPL11 redundantly controls proper development of lateral organs in association with shoot maturation in the reproductive phase. SPL2; SPL10; and SPL11; suppress root regeneration with age by inhibiting wound-induced auxin biosynthesis.	protein_coding	SQUAMOSA PROMOTER-LIKE 11 (SPL11)	SQUAMOSA PROMOTER-LIKE 11 (SPL11)	
AT1G51600	AT1G51600.1	member of a novel family of plant-specific GATA-type transcription factors.	protein_coding	ZIM-LIKE 2 (ZML2)	ZIM-LIKE 2 (ZML2); (TIFY2A);GATA TRANSCRIPTION FACTOR 28 (GATA28)	
AT1G43160	AT1G43160.1	encodes a member of the ERF (ethylene response factor) subfamily B-4 of ERF/AP2 transcription factor family (RAP2.6). The protein contains one AP2 domain. There are 7 members in this subfamily.	protein_coding	RELATED TO AP2 6 (RAP2.6)	RELATED TO AP2 6 (RAP2.6);ETHYLENE RESPONSIVE FACTOR113 (ERF113)	
AT1G03800	AT1G03800.1	encodes a member of the ERF (ethylene response factor) subfamily B-1 of ERF/AP2 transcription factor family (ATERF-10). The protein contains one AP2 domain. There are 15 members in this subfamily including ATERF-3; ATERF-4; ATERF-7; and leafy petiole.	protein_coding	ERF DOMAIN PROTEIN 10 (ERF10)	ERF DOMAIN PROTEIN 10 (ERF10);ARABIDOPSIS THALIANA RF DOMAIN PROTEIN 10 (ATERF10)	
AT1G32240	AT1G32240.1	Encodes a member of the KANADI family of putative transcription factors. Together with KAN1; this gene appears to be involved in the development of the carpel and the outer integument of the ovule.Along with KAN1 and KAN4 appears to regulate the proper localization of PIN1 in early embryogenesis.	protein_coding	KANADI 2 (KAN2)	KANADI 2 (KAN2)	
AT1G29280	AT1G29280.1	member of WRKY Transcription Factor; Group II-e The mRNA is cell-to-cell mobile.	protein_coding	WRKY DNA-BINDING PROTEIN 65 (WRKY65)	WRKY DNA-BINDING PROTEIN 65 (WRKY65);WRKY DNA-BINDING PROTEIN 65 (ATWRKY65);ABNORMAL 33 THERMOMORPHOGENESIS 3 (ABT3)	
AT1G25550	AT1G25550.1	Member of HHO/HRS GARP type transcriptional repressor family. Involved in Pi uptake and Pi starvation signaling. Transcriptional repressors that functions with other NIGT genes as an important hub in the nutrient signaling network associated with the acquisition and use of nitrogen and phosphorus.	protein_coding	HRS1 HOMOLOG3 (HHO3)	HRS1 HOMOLOG3 (HHO3);NITRATE-INDUCIBLE, GARP-TYPE TRANSCRIPTIONAL REPRESSOR 1/HYPERSENSITIVE TO LOW PI-ELICITED PRIMARY ROOT SHORTENING 1.1 (NIGT1.1)	
AT1G43700	AT1G43700.1	Encodes a VirE2-interacting protein.  VIP1 mediates nuclear translocation of VirE2 via its amino half; and interacts with histone H2A via it carboxyl half. Involved in osmosensory response. The mRNA is cell-to-cell mobile.	protein_coding	VIRE2-INTERACTING PROTEIN 1 (VIP1)	VIRE2-INTERACTING PROTEIN 1 (VIP1);SULPHATE UTILIZATION EFFICIENCY 3 (SUE3); (ATVIP1)	
AT1G32150	AT1G32150.1	Encodes a G group bZIP transcription factor family member that can bind cis elements with an ACGT core; such as G-box; Hex; C-box and As-1.  The protein is localized in the nucleus and can homodimerize and can heterodimerize with other G group members.	protein_coding	BASIC REGION/LEUCINE ZIPPER TRANSCRIPTION FACTOR 68 (bZIP68)	BASIC REGION/LEUCINE ZIPPER TRANSCRIPTION FACTOR 68 (bZIP68); (AtbZIP68)	
AT1G16490	AT1G16490.1	Member of the R2R3 factor gene family.	protein_coding	MYB DOMAIN PROTEIN 58 (MYB58)	MYB DOMAIN PROTEIN 58 (AtMYB58);MYB DOMAIN PROTEIN 58 (MYB58)	
AT1G06850	AT1G06850.1	bZIP protein involved in heat stress response. Under heat stress localization moves exclusively to nucleus.	protein_coding	BASIC LEUCINE-ZIPPER 52 (bZIP52)	BASIC LEUCINE-ZIPPER 52 (bZIP52);BASIC LEUCINE-ZIPPER 52 (AtbZIP52)	
AT1G06180	AT1G06180.1	member of MYB3R- and R2R3- type MYB- encoding genes	protein_coding	MYB DOMAIN PROTEIN 13 (MYB13)	MYB DOMAIN PROTEIN 13 (ATMYB13); (ATMYBLFGN);MYB DOMAIN PROTEIN 13 (MYB13)	
AT1G06280	AT1G06280.1	LOB domain-containing protein 2;(source:Araport11)	protein_coding	LOB DOMAIN-CONTAINING PROTEIN 2 (LBD2)	LOB DOMAIN-CONTAINING PROTEIN 2 (LBD2)	
AT1G32870	AT1G32870.3	Expression in rosette leaves is activated by high concentration of boron.	protein_coding			
AT1G22810	AT1G22810.1	encodes a member of the DREB subfamily A-5 of ERF/AP2 transcription factor family. The protein contains one AP2 domain. There are 16 members in this subfamily including RAP2.1; RAP2.9 and RAP2.10. Overexpression leands to delayed senescence and delayed flowering. Negatively regulates plant resistance to P. parasitica by suppressing PAMP-triggered immunity.	protein_coding	 (ATERF019)	 (ATERF019); (ERF19); (ERF019)	
AT1G12260	AT1G12260.1	Encodes a NAC-domain transcription factor that is expressed in developing xylem. Over expression of this protein causes ectopic secondary cell wall growth. Complements some of the cell wall defects seen in SND1/NST1 double mutants.	protein_coding	NAC 007 (NAC007)	NAC 007 (NAC007);NAC 007 (ANAC007);EMBRYO DEFECTIVE 2749 (EMB2749);VASCULAR RELATED NAC-DOMAIN PROTEIN 4 (VND4)	
AT1G14580	AT1G14580.3	C2H2-like zinc finger protein;(source:Araport11)	protein_coding	 (ATIDD6)	 (ATIDD6)	
AT1G13260	AT1G13260.1	Encodes an AP2/B3 domain transcription factor which is upregulated in response to low temperature. It contains a B3 DNA binding domain. It has circadian regulation and may function as a negative growth regulator. The mRNA is cell-to-cell mobile.	protein_coding	RELATED TO ABI3/VP1 1 (RAV1)	RELATED TO ABI3/VP1 1 (RAV1); (ATRAV1);ETHYLENE RESPONSE DNA BINDING FACTOR 4 (EDF4)	
AT1G19040	AT1G19040.1	NAC (No Apical Meristem) domain transcriptional regulator superfamily protein;(source:Araport11)	protein_coding			
AT1G18960	AT1G18960.1	myb-like HTH transcriptional regulator family protein;(source:Araport11)	protein_coding			
AT1G09540	AT1G09540.1	Encodes putative transcription factor. Mutants lack of mucilage extrusion from the seeds during imbibition.  Reduced quantities of mucilage are deposited during the development of the seed coat epidermis in myb61 mutants. Expressed in guard cells;loss of function mutations show an increase in stomatal pore opening suggesting a role in ABA independent regulation of stomatal pore size.	protein_coding	MYB DOMAIN PROTEIN 61 (MYB61)	MYB DOMAIN PROTEIN 61 (MYB61);ARABIDOPSIS THALIANA MYB DOMAIN PROTEIN 61 (ATMYB61)	
AT1G19790	AT1G19790.1	A member of SHI gene family. Arabidopsis thaliana has ten members that encode proteins with a RING finger-like zinc finger motif. Despite being highly divergent in sequence; many of the SHI-related genes are partially redundant in function and synergistically promote gynoecium; stamen and leaf development in Arabidopsis.	protein_coding	SHI-RELATED SEQUENCE 7 (SRS7)	SHI-RELATED SEQUENCE 7 (SRS7)	
AT1G35560	AT1G35560.1	Encodes a member of the TCP-P subfamily that is involved in flowering time control and plant development. Mutants present an early flowering phenotype. Promotes together with TCP7; 8; 14; 15; 21; and 23 endoreduplication-dependent cell expansion in leaf.	protein_coding	TCP DOMAIN PROTEIN 23 (TCP23)	TCP DOMAIN PROTEIN 23 (TCP23); (ATTCP23)	
AT1G20640	AT1G20640.1	(NODULE INCEPTION)-LIKE PROTEIN; together with NLP5 controls a rhizobia-induced decrease in cell elongation rates; while additional cell divisions occurred independently of NLP4.	protein_coding	NIN-LIKE PROTEIN 4 (NLP4)	NIN-LIKE PROTEIN 4 (NLP4)	
AT1G24260	AT1G24260.2	Member of the MADs box transcription factor family. SEP3 is redundant with SEP1 and 2. Flowers of SEP1/2/3 triple mutants show a conversion of petals and stamens to sepals.SEP3 forms heterotetrameric complexes with other MADS box family members and binds to the CArG box motif.	protein_coding	SEPALLATA3 (SEP3)	SEPALLATA3 (SEP3);AGAMOUS-LIKE 9 (AGL9)	
AT1G28360	AT1G28360.1	encodes a member of the ERF (ethylene response factor) subfamily B-1 of ERF/AP2 transcription factor family (ERF12). The protein contains one AP2 domain. There are 15 members in this subfamily including ATERF-3; ATERF-4; ATERF-7; and leafy petiole. Regulates floral development.	protein_coding	ERF DOMAIN PROTEIN 12 (ERF12)	ERF DOMAIN PROTEIN 12 (ERF12);ERF DOMAIN PROTEIN 12 (ATERF12);ETHYLENE RESPONSE FACTOR12 (ERF12)	
AT1G28470	AT1G28470.1	NAC domain containing protein 10;(source:Araport11)	protein_coding	NAC DOMAIN CONTAINING PROTEIN 10 (NAC010)	NAC DOMAIN CONTAINING PROTEIN 10 (ANAC010);SECONDARY WALL-ASSOCIATED NAC DOMAIN PROTEIN 3 (SND3);NAC DOMAIN CONTAINING PROTEIN 10 (NAC010)	
AT1G36060	AT1G36060.1	Encodes a member of the DREB subfamily A-6 of ERF/AP2 transcription factor family. The protein contains one AP2 domain. There are 8 members in this subfamily including RAP2.4.Overexpression results in increased drought tolerance and vitrified leaves. Binds to DRE/GCC promoter elements and activates expression of aquaporin genes AtTIP1;1; AtTIP2;3; and AtPIP2;2.Involved in light induced suppression of germination via regulation of PIF1 and SOM expression. Its DNA binding activity is regulated by phyA and phyB.	protein_coding	TRANSLUCENT GREEN (TG)	TRANSLUCENT GREEN (TG); (WIND3); (ERF55)	
